id, brewery, beer
3445, Uinta Brewing Company, Birthday Suit Sour Cherry Ale (19th Anniversary)
3249, Rough Draft Brewing Company, Southern Triangle IPA
1441, Lagunitas Brewing Company, Maximus
2452, Hollister Brewing Company, Glen Annie Golden
2461, Deschutes Brewery, Jubel (2015)
1205, Miller Brewing Company, Miller Lite
3188, Drake's Brewing Company, Mind Trick
3432, Monkey Paw Brewing Company, Free Ken Allen!
327, Abita Brewing Company, Wrought Iron IPA
994, Angry Orchard Cider Company, Iceman
1566, Deschutes Brewery, Twilight Summer Ale
695, Firestone Walker Brewing Company, Double DBA (2014)
2296, Tioga-Sequoia Brewing Co. , Joaquin Murrieta Chile Pepper Beer
1488, Allagash Brewing Company, Saison
702, Wolf Creek Brewery, Howlin' Hefeweizen
1338, Echigo Beer Co., Koshihikari Echigo Beer
3120, New Glarus Brewing Company, IIPA (Thumbprint)
2698, Green Flash Brewing Co., Flanders Drive (Aged On Cherries)
1088, Hermitage Brewing Company, Ale of the 2 Tun
857, BJ's Restaurant and Brewhouse, HopStorm® IPA
559, Stone Brewing Co., Stone Brewing World Bistro & Gardens - Liberty Station Cimmerian Portal
1276, Saint Archer Brewing Company, Scottish Ale
861, Ninkasi Brewing Company, Oatis Oatmeal Stout
555, The Lost Abbey, Framboise de Amorosa (2013)
943, Firestone Walker Brewing Company, Velvet Merkin (Velvet Añejo)
1836, Lagunitas Brewing Company, DoppelSticky
2387, Societe Brewing Company, The Pupil
2327, The Bruery, Mash & Grind
3704, Cascade Brewing Company (USA), Sang Royal (2009)
716, Dick's Brewing Company, 12 Man Pale Ale
1598, Domaine Le Mieux, Vin De Pomme
362, Carlsberg Ukraine (Карлсберг Украина), Robert Doms Bogemsky (Robert Doms Богемський)
3714, Mendocino Brewing Company, White Hawk (I.P.A.)
1624, Bell's Brewery Inc., Winter White Ale
3374, The Bruery, Imperial Loakal Red
1626, Great Lakes Brewing Company , Christmas Ale
3254, Benchmark Brewing Company, IPA
2858, Sierra Nevada Brewing Co., Bosden
2718, Sierra Nevada Brewing Co., Trip In The Woods Scotch Ale Blend
3439, Avery Brewing Company, Uncle Jacob's Stout
518, Spaten-Franziskaner-Löwenbräu-Gruppe, Spaten Optimator
3072, Anchor Brewing Company, Merry Christmas & Happy New Year (Our Special Ale) (2007)
1958, Lion Brewery Ceylon, Lion Stout
1804, Aftershock Brewing Co, Nu-arizona Bay
3313, Cascade Brewing Company (USA), Noyaux (2011)
3831, New Bohemia Brewing Co., Summer Blonde
3621, Alpine Beer Company (CA), Crazy Hazel
2986, Alpine Beer Company (CA), Exponential Hoppiness
1848, Garage Brewing Co, Chocolate Ghost Pepper Milk Stout
3032, Crooked Stave Artisan Beer Project, Origins (Burgundy Sour)
2356, Birrificio Italiano, La Piccola
906, Sierra Nevada Brewing Co., Bigfoot (2012)
3236, Rogue Ales & Spirits, Old Crustacean (2007)
3358, Pismo Brewing Company, Oatmeal Stout
2708, 3 Floyds Brewing Company, Blot Out The Sun (Barrel Aged)
1096, St. Peter’s Brewery Co., Cream Stout
153, Oggi's Pizza & Brewing Co., Black Magic Stout
700, Heretic Brewing Company, Agony
1150, Ballast Point Brewing & Spirits, Dead Ringer
3446, Sierra Nevada Brewing Co., Brux Domesticated Wild Ale
1100, Ale Industries, Uncle Jesse
2197, Arrogant Bastard Brewing Co., OAKED Arrogant Bastard Ale
2048, Ska Brewing, Decadent Imperial IPA
717, Victory Brewing Company, Prima Pils
1675, Sierra Nevada Brewing Co., Yonder Bock
1280, Ballast Point Brewing & Spirits, Sour Wench With Blueberries
3552, Upright Brewing Company, Fantasia (2013)
2300, Saint Archer Brewing Company, Mandarina Pale Wheat
711, Drawbridge Brewing, Cloudbrew Red Amber
3759, Oskar Blues Brewery, Death By Coconut
3306, Upright Brewing Company, Sole Composition Barrel-Aged Seven Blend
1940, Wild Donkey Brewing Company, Chocolate Moose Porter
3574, Mike Hess Brewing, Deceptio
281, New Belgium Brewing Company, Le Terroir (Lips of Faith)
3210, Craftsman Brewing Company, Cave Art
2905, The Bruery, Rueuze (2013)
1814, Bang The Drum Brewery, Draca
3332, Goose Island Beer Co., Bourbon County Brand Stout (2012)
3501, Firestone Walker Brewing Company, Walker's Reserve Porter
578, Valiant Brewing Company, Bahama Breeze
3184, Coronado Brewing Company, Mermaid's Red
1727, Bang The Drum Brewery, Imperial Rye IPA
2067, Ska Brewing, Rudie Session IPA
1103, Ale Industries, Golden State of Mind
2155, Founders Brewing Co., Breakfast Stout
2977, AleSmith Brewing Company, Speedway Stout (Lapsang Tea)
3362, Cigar City Brewing, Kalevipoeg at the Gates of Hell
931, New Belgium Brewing Company, Le Terroir (Lips of Faith) (2014)
1980, Lightning Brewery, Elemental Pilsner
3907, Bootlegger's Brewery, Palomino Pale Ale
484, Creekside Brewing Company, Hop And Bothered
1596, Strand Brewing Co., Harvest Ball
233, The Lost Abbey, Inferno Ale
2640, Bootlegger's Brewery, SoCo IPA
423, Ballast Point Brewing & Spirits, Big Eye IPA
1688, Unibroue, La Fin Du Monde
2654, Trinity Brewing Co. (Colorado), Old Growth
1161, High Hops Brewery, The Noble One
1829, Aftershock Brewing Co, Nova
837, W Brewing, 559 WSA (Wawona Strawberry Ale)
2302, The Rare Barrel, Another World
3651, Burnside Brewing Co. (Oregon), Sweet Heat
2125, AleSmith Brewing Company, Evil Dead Red
1543, Hermitage Brewing Company, Extra Super Duper Galen
3201, Surly Brewing Company, CynicAle
2795, Societe Brewing Company, The Pugilist
284, Allagash Brewing Company, Victoria (2014)
1939, Angel City Brewery, Lo-Lo
1867, Reverend Nat's Hard Cider, Deliverance Ginger Tonic
599, Abbaye de Maredsous, Maredsous 10° Triple
191, Oskar Blues Brewery, Mama's Little Yella Pils
1679, Coors Brewing Company, Keystone Light
2991, Arrogant Bastard Brewing Co., Double Bastard Ale (2006)
3190, New Belgium Brewing Company, Brett Beer (Lips of Faith)
1027, Green Flash Brewing Co., Rayon Vert
474, Orion Breweries Ltd., Orion Premium Draft
769, Tap It Brewing Co, Snafu
2118, Clown Shoes, Clementine
2557, Stone Brewing Co., Stone w00tstout 2.0
2406, Sixpoint Brewery, Resin
602, North Coast Brewing Company, Old Stock Ale (2015)
3839, Santa Cruz Ale Works, Dark Night Oatmeal Stout
3225, Monkey Paw Brewing Company, Hooked On Chinook
1714, The Bruery, Tart of Darkness (2013)
1227, Brasserie Fantôme, La Dalmatienne
1323, Golden Road Brewing, Wolf Among Weeds
3673, AleSmith Brewing Company, Wee Heavy (WLP041)
3223, Mission Brewery, Falconer's IPA
3905, Humboldt Brewing Company, Red Nectar
641, Widmer Brothers Brewing, Barrel-Aged Brrrbon (2013)
211, Radeberger Gruppe, Radeberger Pilsner
844, Tap It Brewing Co, Three On the Tree
3403, Belching Beaver, Saison De Beaver
1342, Karl Strauss Brewing Company, Pintail Pale Ale
3772, New Belgium Brewing Company, Le Terroir (Lips of Faith) (2015)
3207, Ladyface Alehouse and Brasserie, Midnight Special
1062, Stone Brewing Co., Stone Go To IPA
489, Allagash Brewing Company, Curieux (2014)
263, Stone Brewing Co., Stochasticity Project: HiFi + LoFi Mixtape
2602, The Bruery, Provisions Series: Mother Funker
3187, Drake's Brewing Company, Zinful Drakonic
3604, Rip Current Brewing Co., Barrier Reef Nut Brown Ale
141, The Bruery, Batch #1 Levud's (2015)
623, Karl Strauss Brewing Company, Oktoberfest
3325, Brasserie Cantillon, Saint Lamvinus (2008)
3158, Sierra Nevada Brewing Co., Celebration Ale (2008)
3754, Deschutes Brewery, Black Butte XXIII
1292, AleSmith Brewing Company, Decadence (2014)
1516, Green Flash Brewing Co., Palate Wrecker
1116, Lagunitas Brewing Company, Fusion 32
3078, Stone Brewing Co., 08.08.08 Vertical Epic Ale
3748, Best Damn Brewing Co., Best Damn Root Beer
2798, Alaskan Brewing Co., Jalapeño Imperial IPA
2715, Weyerbacher Brewing Company, Tango
851, Brouwerij Huyghe, Delirium Tremens
320, The Lost Abbey, Red Barn Ale
3529, 3 Floyds Brewing Company, Murda'd Out Stout
3545, Flat Tail Brewing, No
207, The Lost Abbey, Deliverance (2013)
1815, Firestone Walker Brewing Company, Hammersmith IPA
351, Sierra Nevada Brewing Co., Hop Hunter IPA
297, Central Coast Brewing, Lizard Hill
2352, Green Flash Brewing Co., Natura Morta with Boysenberry
3591, The Bruery, A Stein's Throw
230, Surf Brewery, Strawberry Wahine
2983, Alpine Beer Company (CA), Chez Monus
635, The Bruery, Mélange No. 1
937, The Matt Brewing Company (Saranac), Saranac Pumpkin Ale
1654, Weisses Bräuhaus G. Schneider & Sohn, Mein Grünes / Wiesen Edel-Weisse (TAP4)
574, Phantom Ales, Cranberry Pomegranate Meade
1405, Artifex Brewing Company, Hibisc-This
1954, Brasserie d'Achouffe, La Chouffe
678, Rogue Ales & Spirits, Shakespeare Oatmeal Stout
2473, Alpine Beer Company (CA), Captain Stout
3521, Stone Brewing Co., Bottleworks 13th Anniversary Ale
636, The Bruery, Black Tuesday (2015)
300, Anderson Valley Brewing Company, Blood Orange Gose
2638, Sierra Nevada Brewing Co., Double Latte
3627, FiftyFifty Brewing Co., Eclipse - Heaven Hill Rye (2010)
1402, Boston Beer Company (Samuel Adams), Samuel Adams New World
1176, Rough Draft Brewing Company, Grapefruit Weekday IPA
2872, Drake's Brewing Company, One Hit Warrant
1684, Paulaner Gruppe, Paulaner Hefe-Weizen/Hefe-Weißbier Naturtrüb / Natural Wheat / Bräuhaus Weizen
3711, Central Coast Brewing, Cali Pils
2996, Ballast Point Brewing & Spirits, Victory at Sea (2012)
3271, Stone Brewing Co., Stone Brewing World Bistro & Gardens - Liberty Station 12/15 IPA: Ales for ALS IPA
1583, Anderson Valley Brewing Company, Summer Solstice
1470, Shock Top Brewing Co., Raspberry Wheat
3851, Woodstock Inn Brewery, Pig's Ear Brown Ale
3310, Alpine Beer Company (CA), Magnificent Seven
2394, Oskar Blues Brewery, Good Game
60, Figueroa Mountain Brewing Co., Davy Brown Ale
2521, To Øl, Sur Mælk
3307, Jackie O's Pub & Brewery, Dark Apparition Coffee
2314, de Garde Brewing, Imperial Cherry Raz Bu
1259, Sierra Nevada Brewing Co., Bigfoot (2014)
2625, Almanac Beer Co., Dogpatch Strawberry
1602, Caledonian Brewing Company , British Pale Ale
493, 21st Amendment Brewery , Gigantes IPA
1265, Anaheim Brewery, Tavern Ale
3654, Stone Brewing Co., Stone 06.06.06 Vertical Epic Ale
1188, Barley Forge Brewing Co., The Patsy
315, The Bruery, 7 Swans-A-Swimming
2389, Oskar Blues Brewery, Sherry Butt Sour Pilsner
1744, Trimtab Brewing Company, Revelator Pale Ale
3878, Santa Monica Brew Works, Wit
2006, Rough Draft Brewing Company, Hop Therapy
701, Bear Republic Brewing Co., Tartare™
2236, Naparbier, Light Raven
881, Deschutes Brewery, The Abyss (2014)
283, Allagash Brewing Company, Victor (2014)
1425, Pizza Port Brewing Co. , Double Barney IPA
2728, Bear Republic Brewing Co., Tartare Rouge™
2009, Sudwerk Brewing Co., Doppelbock Ultimator
1122, Goose Island Beer Co., Autumn Ale
261, Seattle Cider Company, Three Pepper
1026, AleSmith Brewing Company, Nut Brown Ale
3287, New Belgium Brewing Company, Paardebloem (Lips of Faith)
2626, Venice Beach Beer Company, June Gloom
3303, Weyerbacher Brewing Company, Riserva (2012)
3424, Stone Brewing Co., Stone Enjoy By 04.20.13 IPA
1531, Blue Moon Brewing Company, White IPA
3605, Rip Current Brewing Co., Paddling Out
2358, Birrificio Italiano, Scires
1240, Avery Brewing Company, White Rascal
2248, FrogBeer, Tha Wack!
2734, Stone Brewing Co., Stone Cali-Belgique IPA (Aged in White Wine Barrels)
19, AMBEV, Brahva
1708, Fox Barrel, Pacific Pear Cider
408, Ballast Point Brewing & Spirits, Longfin Lager
3154, Almanac Beer Co., Farmer’s Reserve No. 3
348, Oskar Blues Brewery, Ten FIDY (Barrel Aged)
1782, Ballast Point Brewing & Spirits, Copper Ale
2140, Stone Brewing Co., 2011 Stone Old Guardian BELGO Barley Wine
1263, Anaheim Brewery, Conrad's Kolsch
89, Firestone Walker Brewing Company, 805 Blonde
834, W Brewing, 559 BBA
1513, Telegraph Brewing Company, California Ale
2999, Firestone Walker Brewing Company, Helldorado
277, Humboldt Brewing Company, Humboldt Brown Hemp Ale
507, Duvel Moortgat, Duvel
228, Dust Bowl Brewing Company, The Great Impression Stock Ale
1746, Good People Brewing Company, Brown Ale
2224, Anchorage Brewing Company, Bitter Monk
3540, Goose Island Beer Co., Bourbon County Brand Stout Cherry Rye
282, The Bruery, Rueuze
1146, Coronado Brewing Company, Sock Knocker (2015)
2799, Brewery Ommegang, Adoration (2014)
1998, Brewery Ommegang, Cooperstown Ale
1879, Electric Brewing Company, Dan's Brown Ale
3844, Altamont Beer Works (California), Mac Drizzle
3894, Sierra Nevada Brewing Co., Summerfest (2014)
1996, The Bruery, Smoking Wood (w/ Mole) (2014)
1318, Beach City Brewery, Mojito Saison
2076, Angel City Brewery, Avocado Ale
1906, Wild Donkey Brewing Company, PB&J Stout
727, Double Mountain Brewery & Taproom, Hop Lava
585, Barley Forge Brewing Co., The Orange Curtain
3890, Heretic Brewing Company, Torment
3113, The Lost Abbey, Track #2: Stairway To Heaven
2417, New Belgium Brewing Company, Rock Star Blend
3807, Founders Brewing Co., Kentucky Breakfast Stout (KBS) (2015)
3628, Bell's Brewery Inc., Cherry Stout
3147, ManRock Brewing Co., Petite Syrah Barrel Aged
1542, Omission Beer, Gluten Free IPA
2908, Stone Brewing Co., Smoked Porter w/ Vanilla Bean
2316, Institution Ale Company, Imperial Restraint
2407, Bootlegger's Brewery, Rocco Red Ale
604, The Matt Brewing Company (Saranac), Saranac Season's Best Nut Brown Lager
2223, BrewFist, Spaghetti Western
1331, O'Hara's Brewery (Carlow Brewing Company), O'Hara's Leann Folláin
3459, Russian River Brewing Company, Pliny the Younger
535, Stone Brewing Co., 2013 Stone Old Guardian OAK-SMOKED Barley Wine Aged In American & French Oak
1611, Spaten-Franziskaner-Löwenbräu-Gruppe, Franziskaner Hefe-Weissbier Naturtrüb
1477, Pizza Port Brewing Co. , Get To The Hopper
565, Homebrew, Pumpkin Ale
2245, Brouwerij Boon, Kriek
219, Stone Brewing Co., Chai-Spiced Imperial Russian Stout (2015)
1505, Firestone Walker Brewing Company, Taproom Brown
3880, Fire Island Beer Company, Sea Salt Ale
3645, Pretty Things Beer & Ale Project, Babayaga
2620, Arrogant Bastard Brewing Co., Lukcy Basartd Ale (2010)
1236, Left Coast Brewing, Red Tide
3242, Lagunitas Brewing Company, Fusion 16
756, Firestone Walker Brewing Company, Walker's Reserve Imperial Porter
2330, Upland Brewing Company, Peach Lambic
3140, Seabright Brewery, The Blur
3823, Altamont Beer Works (California), New Kids on the Hops
149, Coronado Brewing Company, Punk'in Drublic
2964, Alpine Beer Company (CA), Ichabod Ale (2012)
2745, 3 Floyds Brewing Company, Dark Lord (2013)
1224, Bottle Logic Brewing, Ideation
2550, Dogfish Head Craft Brewery, 75 Minute IPA
1340, Karl Strauss Brewing Company, Tank Tap Klosch Style Ale
3751, Cölner Hofbräu Früh, Früh Kölsch
1368, Freigeist Bierkultur, Geisterzug Gose
2885, Kern River Brewing Company, Pumpkin Ale
3623, Green Flash Brewing Co., 8th Anniversary Beer - Surfs Up Symposium IPA
163, Port Brewing Company, Hop-15 Ale
2532, Cascade Brewing Company (USA), The Vine
657, The Libertine Pub, Summer Breeze
3005, Sierra Nevada Brewing Co., DevESTATEtion (2013)
2756, Bottle Logic Brewing, Anaheim_ California
1093, Omer Vander Ghinste Brewery, Vanderghinste Oud Bruin
3478, Coronado Brewing Company, Wet Willie
910, Telegraph Brewing Company, Winter Ale (2014)
1421, Eagle Rock Brewery, Populist
3000, Beachwood Brewing, Hop Jitsu
1523, Trader Joe's (JosephsBrau), Trader José Dark Lager
3512, Telegraph Brewing Company, Obscura Vulpine
913, Affligem Brouwerij, Affligem Noël (Christmas Ale)
3073, Island Brewing Company, Avocado Honey Ale
1102, Bang The Drum Brewery, King Maté
3151, Surly Brewing Company, Bitter Brewer
293, Crispin Cider Company, BlackBerry Pear Cider
993, Speakeasy Ales & Lagers, Double Daddy Imperial IPA
2510, Duvel Moortgat, Duvel Tripel Hop (2014)
2710, Moonlight Brewing Company, Old Combine
1016, The Lost Abbey, Road to Helles
241, Deschutes Brewery, Class of '88 Belgian Style Ale
1732, Kane Brewing Company, Silent Nights
1212, Boulevard Brewing Co., Heavy Lifting IPA
858, Cervecería Mexicana S. de R.L. de C.V. (Tecate), Pay the Ferryman
3124, Surly Brewing Company, OverRated
1751, Green Flash Brewing Co., Cedar Plank Pale Ale
1038, Flying Dog Brewery, Snake Dog IPA
3725, Bang The Drum Brewery, Session IPA
1449, Shock Top Brewing Co., Belgian White
3096, Big Sky Brewing Company, Heavy Horse
1552, Pyramid Breweries, Hefeweizen
3690, The Lost Abbey, 10 Commandments (2007)
2508, BFM (Brasserie des Franches-Montagnes), Abbaye de Saint Bon-Chien
3846, Alvarado Street Brewery & Grill, 1297 Scotch Ale
3461, Monkey Paw Brewing Company, Sweet Tea
188, Stone Brewing Co., Stone Farking Wheaton w00tstout (2015)
3466, Jolly Pumpkin Artisan Ales, Bam Noire
433, Spoetzl Brewery, Shiner Bohemian Black Lager (Shiner 97)
2383, Dunbar Brewing, Stupor Sonik Stout
2313, Westbrook Brewing Co., Lichtenhainer
3837, Altamont Beer Works (California), Smoke N Dank
196, Off Color Brewing, Fierce
2093, Coronado Brewing Company, Jurata
48, Green Flash Brewing Co., Treasure Chest (2015)
1024, Mike Hess Brewing, Habitus
2849, Cellarmaker Brewing Company, The Vastness Of Space
2097, Backstreet Brewery (Lamppost Pizza), Tomahawk Double IPA
1527, Homebrew, American Wheat
2890, Sierra Nevada Brewing Co., Clown Car Gold
3842, Golden Road Brewing, Heal The Bay IPA
683, Latrobe Brewing Co., Rolling Rock Extra Pale
2212, Sierra Nevada Brewing Co., Estate Homegrown IPA
456, Spaten-Franziskaner-Löwenbräu-Gruppe, Franziskaner Hefe-Weissbier Dunkel
842, Hermitage Brewing Company, Sour Pumpernickel Rye
1842, Heroes Restaurant & Brewery, Sneak Preview Imperial Stout
3661, Monkey Paw Brewing Company, Jerry's Farewell
1349, Brouwerij Van Honsebrouck, St. Louis Gueuze Fond Tradition
582, Barley Forge Brewing Co., Fugue State Aged In Bourbon Barrels
690, Elysian Brewing, Dragonstooth Stout
715, Drawbridge Brewing, Belltown APA
633, Bottle Logic Brewing, Lagerithm
294, Stone Brewing Co., Stone Enjoy By 04.20.15 IPA
1635, Coachella Valley Brewing Company , Monumentous IPA
2895, Russian River Brewing Company, Temptation (Batch 004)
3816, Sante Adairius Rustic Ales, West Ashley (Batch 10)
3885, Mad River Brewing Company, Jamaica Red Ale
988, Abita Brewing Company, Pecan Harvest Ale
1044, De Proefbrouwerij, Reinaert Flemish Wild Ale
3589, Stumblefoot Brewing Company, Moho American Stout
2074, Coronado Brewing Company, 18th Anniversary
719, Bale Breaker Brewing, Topcutter IPA
2934, Brasserie Dieu du Ciel, Herbe à Détourne
3314, Alpine Beer Company (CA), Gouden Vallei
154, Barrel Harbor Brewing, Blunderbuss Belgian Blonde
1446, Cismontane Brewing Co., Blacktoberfest
3112, The Lost Abbey, Track #3: Hell's Bells
2419, Jagged Mountain Craft Brewery, Ptarmigan Ridge
3059, Sixpoint Brewery, Bengali Tiger
1065, Sierra Nevada Brewing Co., Ovila Abbey Quad with Plums
3390, Pacific Brewing Laboratory, Nautilus
3626, Mikkeller, Spontanwildstrawberry
2103, Inland Empire Brewing Company, Victoria
81, Lagunitas Brewing Company, IPA
2819, Brasserie Artisanale de Rulles, La Rulles Triple
2082, Speakeasy Ales & Lagers, Vendetta IPA
1430, Left Coast Brewing, Asylum
299, Big Sky Brewing Company, IPA
2466, AleSmith Brewing Company, Barrel Aged Old Numbskull (2013)
2747, Hangar 24 Craft Brewery, Pugachev's on Coconut and Cacao
2589, Brewery Ommegang, Chocolate Indulgence
900, House Of Pendragon Brewing Co., Popeman Porter
1344, The Lost Abbey, Deliverance
56, Karl Strauss Brewing Company, Wreck Alley Imperial Stout
3841, Alvarado Street Brewery & Grill, Blackbeard's Delight
2663, The Bruery, Tumescence
390, Wyder's Cider, Dry Pear Hard Cider
2215, Hangar 24 Craft Brewery, Oktoberfest Fall Lager (2015)
2182, Maui Brewing Company, Lorenzini Double IPA
322, Firestone Walker Brewing Company, Sucaba (2014)
3116, New Glarus Brewing Company, 20th Anniversary Strong Ale
2668, Craftsman Brewing Company, Stone Fruit Sour
200, Ballast Point Brewing & Spirits, Grunion Pale Ale
51, Green Flash Brewing Co., Styrian Golding
1007, Omer Vander Ghinste Brewery, Cuvée Des Jacobins Rouge
2227, Drake's Brewing Company, Hella Fresh Pale Ale
529, New Belgium Brewing Company, Abbey
2573, Drake's Brewing Company, Aroma Prieta
2669, Bear Republic Brewing Co., Cuvee de Bubba™
1374, Pizza Port Brewing Co. , Owlbear
631, Bottle Logic Brewing, Chateau De Logique
852, Cervecería Mexicana S. de R.L. de C.V. (Tecate), Immortal Beloved Hefeweizen
1077, Founders Brewing Co., Curmudgeon Old Ale (2012)
2428, Odell Brewing Co., Wolfpicker (2015)
2873, ManRock Brewing Co., Apocalyptic
1053, Coors Brewing Company, Coors Light
2218, House Of Pendragon Brewing Co., Dark Magic
3213, Belching Beaver, Tail Slap'd XPA
2984, Alpine Beer Company (CA), Odin's Raven
1633, Steinhaus Brewing Company, Jumping Cow Amber Ale
2517, Pizza Boy Brewing Co., Eternal Sunshine
1711, Figueroa Mountain Brewing Co., Figueroa Mountain Pale Ale
1060, House Of Pendragon Brewing Co., HoP English Blonde Ale
3691, The Lost Abbey, Red Poppy Ale (2010)
1802, Tahoe Mountain Brewing Company, Dark Ages Brett Stout
2050, Hangar 24 Craft Brewery, Barrel Roll No. 5 - Chandelle (2014)
1607, New Belgium Brewing Company, Porch Swing
3071, Coronado Brewing Company, Milk Stout
2860, Mikkeller, Black Fist
1881, Electric Brewing Company, Ginger Ninja
2464, Deschutes Brewery, The Abyss (2010)
3857, The Duck-Rabbit Craft Brewery, Brown Ale
691, Pizza Port Brewing Co. , Swami's IPA
3102, The Libertine Pub, Straw Hat
829, Saint Archer Brewing Company, Mosaic IPA
1643, Central Coast Brewing, Catch 23
3815, Alvarado Street Brewery & Grill, Alta California Pale Ale
1866, Sierra Nevada Brewing Co., Oktoberfest - Brauhaus Riegele (2015)
195, Humboldt Brewing Company, 500 B.C. Double IPA
1928, Stone Brewing Co., Liberty Station Space Bar Friends
3165, Hangar 24 Craft Brewery, Barrel Roll No. 4 - Hammerhead (2013)
2500, Bell's Brewery Inc., Hopslam Ale (2015)
2958, Alaskan Brewing Co., Pumpkin Porter
3162, Dock Street Brewing Co., ABT 12
3457, Prohibition Brewing Company, Shotgun Saison
1001, Karl Strauss Brewing Company, Tower 10 IPA
2088, Sanctum Brewing Co., Newtonian
3435, Ipecac, Amber Alert
369, North Coast Brewing Company, Scrimshaw Pilsner
614, Pure Order Brewing Company, Black Gull Porter
2026, Boulevard Brewing Co., Double-Wide I.P.A.
3285, Butcher's Brewing, Fair Weather Friend
1742, Dogfish Head Craft Brewery, 120 Minute IPA (2014)
2657, Black Diamond Brewing Company, White Witch IPA
167, Mother Earth Brew Co. (California), Cali' Creamin'
2727, Drake's Brewing Company, Brette Davis Eyes
3178, Hangar 24 Craft Brewery, Belgian Summer Ale
1076, Founders Brewing Co., Backwoods Bastard (2013)
3323, AleSmith Brewing Company, YuleSmith (Summer) (2013)
572, Phantom Ales, Russian Imperial Stout
2141, The Lost Abbey, Deliverance (2011)
3341, Brasserie de la Senne, Zwarte Piet
824, Veteran Beer Company, Blonde Bomber
109, Anderson Valley Brewing Company, Fall Hornin'
771, SLO Brewing Company, Saphead
464, Los Gatos Brewing Company, Cougar Town IPA
3692, The Lost Abbey, Cuvee de Tomme (2009)
3127, Stone Brewing Co., Stone Enjoy By 09.13.13 IPA
637, The Bruery, Wineification II
1009, The Lost Abbey, Serpent's Stout
3646, The Bruery, Go Team!
1008, Port Brewing Company, Mongo Double IPA
2011, 2 Towns Ciderhouse, The Bad Apple
839, W Brewing, 559 WPA (Wawona Peach Ale)
2355, Ballast Point Brewing & Spirits, Sour Wench With Apricots
3069, Speakeasy Ales & Lagers, Butchertown India Black Ale
273, Stadium Brewing Company, Citra Takeover DIPA
1354, Abita Brewing Company, Purple Haze
580, Valiant Brewing Company, Alpha Drive
915, Wychwood Brewery, Bah Humbug
1946, The Mason Jar Brewing Company, Raging Rooster 
1550, Hermitage Brewing Company, Ironwood Dark
3758, Green Flash Brewing Co., Segal Ranch Session IPA
3856, Adirondack Brewery, Bear Naked Ale
1360, Bayerische Staatsbrauerei Weihenstephan, Weihenstephaner Original
3792, Fremont Brewing, The Brother Imperial IPA
2787, Bear Republic Brewing Co., Churchill's Pale
807, Schilling Cider, Pomegranate Cranberry
746, Bear Republic Brewing Co., Racer X (2015)
947, Firestone Walker Brewing Company, Firestone 15 (XV) Anniversary Ale
3688, The Lost Abbey, Duck Duck Gooze
605, Gordon Biersch Brewing Company, WinterBock
1560, Boston Beer Company (Samuel Adams), Samuel Adams Summer Ale
419, Ballast Point Brewing & Spirits, Grapefruit Sculpin
1917, Alosta Brewing Co., Swindler's Spice
3182, Brewery Ommegang, Scythe & Sickle
1600, See Canyon Hard Cider Co., See Canyon Hard Cider Premium Dry
262, New Belgium Brewing Company, Pear Ginger Beer (Lips of Faith)
3485, Steelhead Brewing Co., Wee HEAVY Scotch Ale
2098, Backstreet Brewery (Lamppost Pizza), Rita Red
2854, Mikkeller, Spontanpeach
3826, Cellarmaker Brewing Company, Hop Killah IPA
137, The Bruery, Coffee Smoking Wood
1826, Great Divide Brewing Company, Fresh Hop
2328, Jester King Brewery, Le Petit Prince Farmhouse Table Beer
210, Deschutes Brewery, Pinedrops IPA
313, Saint Archer Brewing Company, Irish Dry Stout
306, Dogfish Head Craft Brewery, Aprihop
713, DESTIHL Brewery, Amra Mango IPA
2290, Green Flash Brewing Co., Flanders Drive
1307, Mission Brewery, Carrack
3513, Beachwood Brewing, Tart Simpson
2206, Sierra Nevada Brewing Co., Hellraiser - Chocolate Chili Imperial Stout
2409, Beachwood Brewing, Mocha Machine
27, SweetWater Brewing Company , 420 Extra Pale Ale
2760, Mammoth Brewing Company, IPA 395
2396, Oskar Blues Brewery, Tickled Pink
2541, The Bruery, Filmishmish (2014)
3061, Evolution Craft Brewing Company, Rise Up Stout
2765, Steelhead Brewing Co., Double Play IPA
576, Phantom Ales, Barrel Aged Sour Saison
767, Allagash Brewing Company, Curieux (2015)
2643, Cigar City Brewing, Forgotten Island
525, Deschutes Brewery, Mirror Mirror (2014)
962, Brauerei Aying , Celebrator
3053, Russian River Brewing Company, Redemption
1851, Almanac Beer Co., Paris of the West
2166, Anderson Valley Brewing Company, Briney Melon Gose
1609, Full Sail Brewing Company, IPA
1573, Miller Brewing Company, Miller Genuine Draft
3274, Coronado Brewing Company, Berry The Hatchet
1378, Left Coast Brewing, Barrel Aged Scottish Style Export Ale
1495, Pizza Port Brewing Co. , Danger Zone (San Clemente)
2228, Drake's Brewing Company, Wild Hundo
3509, Cigar City Brewing, Florida Cracker
2844, Drake's Brewing Company, Jupiter OTC Pilsner
