id, brewery, beer
620, Victory Brewing Company, Winter Cheers
630, Noble Ale Works, Gosebusters
220, Ballast Point Brewing & Spirits, Sextant
1394, Victory Brewing Company, Golden Monkey
694, The Libertine Pub, Biere De Table Framboise
2321, FiftyFifty Brewing Co., Eclipse - Rebel Yell (2012)
3047, Port Brewing Company, High Tide Fresh Hop IPA
528, Dogfish Head Craft Brewery, Burton Baton
3173, Deschutes Brewery, Class of '88 Barleywine Ale
2345, Institution Ale Company, Disarray
3819, Caldera Brewing Company, Mogli
34, Southern Tier Brewing Company, 2xIPA
3469, Dogfish Head Craft Brewery, Poppaskull
2712, Ballast Point Brewing & Spirits, Victory at Sea (Rye Barrel Aged)
1537, Sprecher Brewing Company, Hard Apple Pie
3496, Automatic Brewing Co., White Riot
3447, Stone Brewing Co., 2013 Stone Ruination IPA aged in Bourbon Barrels
799, Mission Brewery, Shipwrecked
1901, The Bruery, Freckle
159, Barrel Harbor Brewing, Red Ale
2374, Lengthwise Brewing Company, Cyber Beer Bully
1245, Port Brewing Company, Anniversary Ale
403, Blue Moon Brewing Company, Cinnamon Horchata Ale
886, Firestone Walker Brewing Company, Sucaba
3600, Craftsman Brewing Company, Holiday Spruce Ale
2703, FiftyFifty Brewing Co., Belgian Lipstick
2988, Arrogant Bastard Brewing Co., Double Bastard Ale (2012)
468, Cellarmaker Brewing Company, Mad Nibs
2591, Societe Brewing Company, The Apprentice
1926, Monkish Brewing Co., Seme della Vita
237, Deschutes Brewery, Zarabanda
1343, Angel City Brewery, Angel City Pilsner
2154, The Lost Abbey, Agave Maria - Tequila Barrel Aged (2015)
2868, Creekside Brewing Company, The Bitter End
424, Echigo Beer Co., Premium Red Ale
184, Uinta Brewing Company, Birthday Suit Sour Plum Abbey Ale (22nd Anniversary)
461, Knee Deep Brewing Company, Hoptologist DIPA
2824, The Libertine Pub, Flower Power
2732, Stone Brewing Co., Stone "The Tiger Cub" Saison aged in White Wine Barrels w/Sour Cherries
874, Firestone Walker Brewing Company, Velvet Merkin
2156, Sante Adairius Rustic Ales, Lucybelle
3025, Riley's Brewing Company, Cougar
88, Figueroa Mountain Brewing Co., Lizard's Mouth
526, Figueroa Mountain Brewing Co., Danish Red Lager
2332, Cascade Brewing Company (USA), Blackberry Ale
244, Strike Brewing, Dark Matter
1738, Firestone Walker Brewing Company, Bretta Weisse
2725, Green Flash Brewing Co., Linchpin On Brett (2013)
950, Firestone Walker Brewing Company, Parabajava
91, Belching Beaver, Me So Honey
2894, Stone Brewing Co., Stone 09.09.09 Vertical Epic Ale
166, Boston Beer Company (Samuel Adams), Samuel Adams Hoppy Red
1581, BarrelHouse Brewing Co, BarrelHouse Rye IPA
1019, Green Flash Brewing Co., Serrano Chili Double Stout
3308, The Bruery, Otiose
1925, McLeod And Sons And Daughter, Scottish Mild
65, Steinhaus Brewing Company, Mission St. Pale Ale
3518, Nebraska Brewing Company, Sexy Betty
3746, SLO Brewing Company, Central Coast Hop Farms Wet Hop IPA
3100, Maine Beer Company, Lunch
1233, 3 Floyds Brewing Company, Skull'Ole
523, Figueroa Mountain Brewing Co., Hurricane Deck
1448, Cismontane Brewing Co., Hop Dumpster
650, Lagunitas Brewing Company, Imperial Pils
1786, Hangar 24 Craft Brewery, Barrel Roll No. 3 - Pugachev's Cobra (2012)
1699, Angry Orchard Cider Company, Apple Ginger
1592, Binding Brauerei, Henninger Premium Lager
1183, Avery Brewing Company, The Beast Grand Cru (2015)
3107, The Lost Abbey, Track #9: Knockin' On Heaven's Door
1277, Voodoo Brewing Company, Single Hop Series Pale Ale (Mandarina Bavaria)
2706, Rahr & Sons Brewing Company, Stormcloud
2209, Fieldwork Brewing Company, Citraweisse
3662, Karl Strauss Brewing Company, Mouette A Trois
3901, Pivovary Staropramen, Staropramen Premium / Ležák
3328, ThirstyBear Brewing Company, Panda Bear
1575, Gordon Biersch Brewing Company, SommerBrau
531, Ballast Point Brewing & Spirits, Three Sheets
3644, Odell Brewing Co., IPA
2613, Karl Strauss Brewing Company, 24th Anniversary Flanders-Style Ale
2060, De Proefbrouwerij, Long of Tooth
664, Tahoe Mountain Brewing Company, Passion Pale
1545, Hermitage Brewing Company, Single Hop Series Super Galena
142, Bruery Terreux®, Karma Chameleon
1780, Los Gatos Brewing Company, El Gatoberfest
536, Stone Brewing Co., 2008 Stone Imperial Russian Stout aged in Bourbon Barrels
3371, The Lost Abbey, Cable Car Ale (2011)
3915, Boston Beer Company (Samuel Adams), Samuel Adams Porch Rocker
2893, The Bruery, Chocolate Rain (2013)
1709, Heineken Brewery Ireland, Murphy's Irish Red
386, Boston Beer Company (Samuel Adams), Samuel Adams Winter Lager
1181, Coronado Brewing Company, 19th Anniversary Imperial IPA
3914, Boston Beer Company (Samuel Adams), Samuel Adams White Lantern
1384, Artifex Brewing Company, Bog Trotter
3470, AleSmith Brewing Company, Barrel Aged Wee Heavy
539, The Dudes' Brewing Company, Grandma's Pecan
1642, Indian Wells Brewing Company, Ground Pup Double Bock Ale
497, New Belgium Brewing Company, Ranger
1123, Victory Brewing Company, Festbier
610, Noble Ale Works, Back In the Day IPA
1905, Ninkasi Brewing Company, Maiden the Shade
977, Dogfish Head Craft Brewery, Punkin Ale
3739, Redhook Brewery, Game Changer
103, Brouwerij Slaapmutske, Slaapmutske Tripel
3682, Brasserie Cantillon, Iris
2341, Green Bench Brewing Co, Oak Fermented Sour Farmhouse Blend #3
2963, Sierra Nevada Brewing Co., Flipside Red IPA (2013)
1409, Figueroa Mountain Brewing Co., 2nd Anniversary - Grand Cru
1023, AleSmith Brewing Company, Old Numbskull
1015, Port Brewing Company, Midnight Expression - formerly Midnight Sessions
3080, Upslope Brewing Company, India Pale Ale
2875, Freigeist Bierkultur, Hoppeditz
414, Belching Beaver, Peanut Butter Milk Stout
588, Lagunitas Brewing Company, Born Yesterday Pale Ale
1433, Carlsberg Group, Carlsberg
2364, Drake's Brewing Company, Hopocalypse Triple IPA (Black Label)
2471, Fieldwork Brewing Company, Burning Daylight
3010, Alpine Beer Company (CA), Chez Monieux
2211, Dogfish Head Craft Brewery, World Wide Stout (2009)
271, Towne Park Brew Co., Blonde 
595, Valiant Brewing Company, Crescendo
1204, Pizza Port Brewing Co. , Bantha Poodoo
2319, Cascade Brewing Company (USA), Figaro
2360, The Bruery, Marrón Acidifié
164, The Lost Abbey, Angel's Share Bourbon-Barrel Aged
2436, Strange Brewing Company, Cherry Kriek
1396, Allagash Brewing Company, Interlude
1127, The Bruery, Humulus Lager
2975, AleSmith Brewing Company, Speedway Stout (Nicaraguan Coffee)
1149, Einstök Ölgerð, Icelandic White Ale
971, Ninkasi Brewing Company, Total Domination IPA
2672, Mikkeller, Betelgeuze
3171, Sierra Nevada Brewing Co., Old Chico Brand Session IPA
328, Calicraft Brewing Co., Cali Cöast
3896, Sierra Nevada Brewing Co., Scotch Ale
117, Åbro Bryggeri, Rekorderlig Premium Strawberry-Lime Cider
735, AleSmith Brewing Company, Speedway Stout
2879, El Segundo Brewing Company, Hop Tanker
3508, Bell's Brewery Inc., Java Stout
1475, Shipyard Brewing Company, Monkey Fist IPA
754, Firestone Walker Brewing Company, Velvet Merkin (2015)
2959, Telegraph Brewing Company, Sanus Spiritibus
1282, Ballast Point Brewing & Spirits, Pescadero Pilsner
704, Old Redwood Brewing Company, Diablo Del Oro
1237, Shmaltz Brewing Company, Wishbone Session Double IPA
3039, FiftyFifty Brewing Co., Zomertime
1182, Åbro Bryggeri, Rekorderlig Passionfruit Hard Cider
577, Valiant Brewing Company, 2nd Anniversary
2449, AC Golden Brewing Co., Colorado Native IPL
3516, Poor House Brewing Company, 30 Hop IPA
92, North Coast Brewing Company, Blue Star
3143, Santa Cruz Mountain Brewing, The Peoples Organic Coffee Porter
2455, BarrelHouse Brewing Co, Sunny Daze - Clementine Blonde Ale
3717, Sierra Nevada Brewing Co., Ovila Golden
3659, New Belgium Brewing Company, Snow Day
2778, The Bruery, Smoking Wood Rye Whiskey Barrel Aged (2014)
2112, Aztec Brewery, Noche de Los Muertos
2016, Epic Brewing Co. (Utah Colorado), Elder Brett
976, Tioga-Sequoia Brewing Co. , Catacomb Brew (Apricot Saison)
3404, Craftsman Brewing Company, Poppyfields
63, Drake's Brewing Company, Black Robusto Porter
1991, Tahoe Mountain Brewing Company, Gose Rustica
2149, Societe Brewing Company, The Coachman
3049, Stone Brewing Co., Stone Enjoy By 10.25.13 IPA
3808, New Bohemia Brewing Co., Twisted Grove Mountain Ale
2399, Dunbar Brewing, Fear Naught IPA
731, Northwest Brewing Company, Hoppy Bitch IPA
606, Fireman's Brew, Fireman's Brew Brunette Beer
72, John Crabbie & Co, Spiced Orange
1681, Homebrew, Golden Lager
87, Redhook Brewery, Fat Chance
1912, Bravery Brewing, Tequila Oaked Old Rat
1947, The Mason Jar Brewing Company, Raz-Ma-Taz 
3713, The Libertine Pub, Xmas Stout
45, Rogue Ales & Spirits, Pumpkin Patch Ale
121, Green Flash Brewing Co., Green Bullet
2910, New Belgium Brewing Company, Heavenly Feijoa Tripel (Lips of Faith)
1999, Great Divide Brewing Company, Espresso Oak Aged Yeti (2014)
862, Sonoma Cider, The Pitchfork Pear Cider
3785, Midnight Sun Brewing Co., Berserker Imperial Stout
1192, Widmer Brothers Brewing, Reserve Vanilla Brrrbon
3486, Steelhead Brewing Co., Hairy Weasel Hefeweizen
3312, Cascade Brewing Company (USA), Bottleworks XIV
62, Firestone Walker Brewing Company, Opal
3296, Green Flash Brewing Co., 1st Anniversary Beer
24, Stone Brewing Co., Xocoveza For The Holidays & The New Year
552, The Lost Abbey, Agave Maria - Tequila Barrel Aged
3386, Terrapin Beer Co. , Hopzilla
805, Hard Pressed Cider Company, Henry Hotspur's Hard Pressed For Cider
3448, Stone Brewing Co., 2013 Stone Old Guardian OAK-SMOKED Barley Wine
3367, Birrificio L'Olmaia, BK nel Salco (Wine Barrel Aged)
3137, Seabright Brewery, Krusty's Kolsch
2737, Institution Ale Company, Coherence
3817, Green Flash Brewing Co., West Coast IPA (2015)
1693, Homebrew, 1 st IPA
1984, Ballast Point Brewing & Spirits, Calico Rum Barrel Aged
3729, SLO Brewing Company, Pilsner
2806, The Lost Abbey, Duck Duck Gooze (2013)
291, North Coast Brewing Company, Old No. 38 Stout
448, Karl Strauss Brewing Company, Big Barrel Double IPA
3793, Funkwerks, Tropic King
1807, Modern Times Beer, Monsters' Park
1725, Firestone Walker Brewing Company, Feral One (Batch 2)
285, Arrogant Bastard Brewing Co., Arrogant Bastard Ale (Bourbon Barrel Aged)
1781, Los Gatos Brewing Company, Coquettish Blonde
2083, Dale Bros. Brewery, Pomona Queen
2028, The Bruery, Ignis Fatuus
3483, Steelhead Brewing Co., Chocolate Kiss Stout
876, Boulevard Brewing Co., Bourbon Barrel Quad
3125, Deschutes Brewery, Jubelale (2012)
1179, Pizza Port Brewing Co. , Hula Skirt
1114, Flying Dog Brewery, Gonzo Imperial Porter
97, Charles Wells Brewery, Banana Bread Beer
1899, Bagby Beer Company, Bruges Cruise
1244, Stone Brewing Co., Stone Enjoy By 07.04.15 IPA
118, Stone Brewing Co., Ruination 2.0 with American Oak
1640, Coachella Valley Brewing Company , Kölschella
3583, Alpine Beer Company (CA), 19/10 O'Briens Anniversary IPA
3191, Ballast Point Brewing & Spirits, Schooner Wet Hop Ale
2545, Coronado Brewing Company, Barrel Aged Old Scallywag
64, Ryan Long, Jack And Half
2611, Societe Brewing Company, The Jackeroo
312, Flying Dog Brewery, Lucky SOB Irish Red Ale
3774, Old Mout Cider, Kiwi & Lime
1541, Sierra Nevada Brewing Co., Vienna Lager
2935, The Bruery, 6 Geese-A-Laying
462, Green Flash Brewing Co., Le Freak
2965, AleSmith Brewing Company, Evil Dead Red (2013)
3721, Bang The Drum Brewery, Bourbon Barrel Aged Porter
2937, Figueroa Mountain Brewing Co., Reno's IPA
2361, The Rare Barrel, Sourtooth Tiger (Blend 2)
2639, Lagunitas Brewing Company, Fusion 23
1632, Mendocino Brewing Company, Red Tail  (Amber Ale)
1580, BarrelHouse Brewing Co, BarrelHouse Blonde Ale
336, Karl Strauss Brewing Company, 26th Anniversary Belgian Dark Strong Ale
3402, Belching Beaver, Rabid Beaver Rye IPA
3539, Flossmoor Station Restaurant and Brewery, Hi-Fi Rye
1407, Winery Exchange World Brews, WingWalker Pale Ale
129, Firestone Walker Brewing Company, Stickee Monkee (2015)
2774, The Dudes' Brewing Company, Juicebox Series: Blood Orange
511, Fox Barrel, Blackberry Pear Cider
859, Cervecería Mexicana S. de R.L. de C.V. (Tecate), Hop On Or Die - DOA IPA
202, Ballast Point Brewing & Spirits, Calm Before The Storm
3159, AleSmith Brewing Company, Decadence (2011)
3830, New Bohemia Brewing Co., Another IPA (Santa Cruz IPA)
394, Cerveceria Costa Rica (Florida Bebidas), Imperial
55, Stone Brewing Co., Stochasticity Project: Varna Necropolis
1832, Brouwerij De Molen, Mout & Mocca
1420, New Zealand Breweries Limited, Steinlager Classic
892, Clown Shoes, Undead Party Crasher
2761, Pizza Orgasmica, Peach Pale Ale
22, Cerveceria Centro Americana, Gallo
1813, Hangar 24 Craft Brewery, Barrel Roll No. 8 - Falling Leaf
1967, Jack's Abby, TrIPL
888, SLO Brewing Company, Oatmeal Stout
1391, Mad River Brewing Company, Steelhead Extra Pale Ale
1443, Lagunitas Brewing Company, Hop Stoopid
436, Spoetzl Brewery, Shiner Kosmos Reserve
2255, Ladyface Alehouse and Brasserie, Dérailleur®
680, The Lost Abbey, Framboise de Amorosa
376, Kiuchi Brewery, Hitachino Nest Red Rice Ale
3083, Ironfire Brewing Company, Six Killer Stout (Coffee Stout)
382, AleSmith Brewing Company, YuleSmith (Winter)
2439, Denver Beer Co, Graham Cracker Porter
1216, Sierra Nevada Brewing Co., Hoptimum
3614, AleSmith Brewing Company, Barrel Aged Decadence (2010)
3891, Heretic Brewing Company, Tafelbully
2689, Dogfish Head Craft Brewery, Positive Contact
2784, Indian Wells Brewing Company, Death Valley Pale Ale
3829, New Bohemia Brewing Co., Whale of An Ale
1434, Wandering Aengus Ciderworks, Anthem Pear
597, Great Divide Brewing Company, Hibernation Ale
1803, Central Waters Brewing Company, Black Gold (2015)
2594, Monkey Paw Brewing Company, Mighty Joe Young
102, Lagunitas Brewing Company, Brown Shugga'
231, Bayerische Staatsbrauerei Weihenstephan, Weihenstephaner Vitus
3418, Mike Hess Brewing, Solis Occasus IPA
1582, BarrelHouse Brewing Co, Templeton - Kolsch Style Ale
2548, Alpine Beer Company (CA), Hoppy Birthday
2195, Alaskan Brewing Co., Winter Ale
340, SLO Brewing Company, Imperial Winter Brown
3195, FiftyFifty Brewing Co., Eclipse - Four Roses Single Barrel (2011)
2310, Institution Ale Company, Restraint
757, Firestone Walker Brewing Company, Parabola (2015)
2924, The Dudes' Brewing Company, Kolschtal Eddy
909, BarrelHouse Brewing Co, Heidbanger - Red Rye Scotch Ale aged in Rye Whiskey Barrels
584, Barley Forge Brewing Co., Future Tripping
402, Heineken, Heineken
1148, Oskar Blues Brewery, Gubna (2015)
3004, Sierra Nevada Brewing Co., Double Dubbel
1498, BJ's Restaurant and Brewhouse, BJ's PM Porter®
3029, New Belgium Brewing Company, Coconut Curry Hefeweizen (Lips of Faith)
1812, Jolly Pumpkin Artisan Ales, Luciérnaga "The Firefly"
500, Brouwerij van Hoegaarden, Hoegaarden Blanche
2404, Sante Adairius Rustic Ales, Farmhouse Noir (Batch 2)
18, Alaskan Brewing Co., Summer Ale
1763, Deschutes Brewery, Petite Sour
2805, The Bruery, The Wanderer (2011)
1330, O'Hara's Brewery (Carlow Brewing Company), O'Hara's Irish Red
16, Cerveceria Centro Americana, Monte Carlo Premium
3156, Sierra Nevada Brewing Co., Bigfoot (2009)
3366, Sierra Nevada Brewing Co., Bigfoot (2000)
2233, Heineken France, Pelforth Blonde
814, Cidrerie Dujardin Condé-sur-Vire, Dan Armor Cidre Bouché Breton Brut
968, Brasserie Dupont, Moinette Blonde
2831, The Rare Barrel, Shadows of Their Eyes (Batch 1)
2512, Sierra Nevada Brewing Co., Coffee Stout
2486, Birra del Borgo, Duchessic Ale
1734, New Belgium Brewing Company, Cocoa Mole (Lips of Faith)
3801, Brewery Ommegang, Rosetta
2322, AleSmith Brewing Company, Beer Geek Speedway
405, Firestone Walker Brewing Company, Velvet Merkin (2013)
777, Einstök Ölgerð, Icelandic Toasted Porter
1129, The Bruery, 8 Maids-a-Milking
3573, 3 Floyds Brewing Company, Pride & Joy Mild Ale
326, Lagunitas Brewing Company, Cappuccino Stout
2024, The Bruery, Black Tuesday
1590, Shock Top Brewing Co., Spiced Banana Wheat
287, Stone Brewing Co., Drew & Steve's Imperial Mutt Brown Ale (Spotlight Series)
832, Tap It Brewing Co, Pi
1319, Barley Forge Brewing Co., The Black Dahlia
240, 21st Amendment Brewery , Monk's Blood
305, Figueroa Mountain Brewing Co., Stagecoach Stout
2269, Stone Brewing Co., Stone Cali-Belgique IPA aged in Red Wine Barrels
879, Widmer Brothers Brewing, Altbitter
800, Deschutes Brewery, Mirror Pond Pale Ale
2225, Black Ops Brewing, Bayonet Brown
1650, Kona Brewing Company, Lemongrass Luau
1411, Ballast Point Brewing & Spirits, Even Keel
3281, Twisted Manzanita Ales, Riverwalk Blonde Ale
3351, AleSmith Brewing Company, Decadence (2010)
2475, The Bruery, Tart of Darkness (w/ Cherries & Vanilla)
1555, Eight Bridges Brewing, Silenus the Dude
1695, Stone Brewing Co., Imperial Russian Stout
629, Noble Ale Works, Nose Candy
1915, Phantom Carriage, Cushing
923, Cambria Beer Company, Whiskey Coffee Stout
3689, The Lost Abbey, Veritas 007
3488, Berryessa Brewing Co., Cliff's Fiscal Barley Wine
3563, Stone Brewing Co., 2003 Stone Imperial Russian Stout
435, Grupo Modelo S.A. de C.V., Corona Light
1764, BridgePort Brewing Co., Old Knucklehead
3443, Rogue Ales & Spirits, XS Imperial India Pale Ale (I²PA)
1834, Uinta Brewing Company, Detour Double IPA
3255, Maui Brewing Company, Liquid Breadfruit
1308, BJ's Restaurant and Brewhouse, Brewhouse Blonde®
1099, Brewery Ommegang, Hennepin Farmhouse Saison
721, Dogfish Head Craft Brewery, Saison du Buff
1599, Stone Brewing Co., Holiday Wine Cellar 50th Anniversary Imperial Irish Stout
2558, Santa Barbara Brewing Company, Pacific Pale Ale
3544, Southampton Publick House, Imperial Russian Stout (2012)
2201, Council Brewing Company, Beatitude Mango Tart Saison
3277, Stone Brewing Co., Stone Brewing World Bistro & Gardens - Liberty Station Commemorative Imperial Stone Pale Ale
1741, The Libertine Pub, Libertine Berlinertine Citra
1105, Stone Brewing Co., Robert Masterson & Ryan Reschan/Rip Current/Stone R&R Coconut IPA
57, Karl Strauss Brewing Company, Four Scowling Owls
1773, Caldera Brewing Company, Khao San Ginger Pale Ale
670, Seattle Cider Company, Dry
3696, The Lost Abbey, Deliverance (2010)
2609, Terrapin Beer Co. , Wake-n-Bake Coffee Oatmeal Imperial Stout
3564, Karl Strauss Brewing Company, 23rd Anniversary Old Ale
3620, Beachwood Brewing, Melrose
1931, Cervecería Mexicana S. de R.L. de C.V. (Tecate), Queen of the Night Pale Ale
905, Stone Brewing Co., Stone Smoked Porter
542, Sierra Nevada Brewing Co., Hoptimum (2013)
2284, Sierra Nevada Brewing Co., 30th Anniversary - Our Brewers Reserve Grand Cru
49, Federation Of Beer, Sindicate
1538, Sprecher Brewing Company, Hard Root Beer
999, Aztec Brewery, Hibiscus Wheat
983, Dogfish Head Craft Brewery, 75 Minute IPA (2014)
1987, Mission Brewery, Coconut Brown Ale
3809, Founders Brewing Co., Dark Penance
860, Cervecería Mexicana S. de R.L. de C.V. (Tecate), Death Becomes You
3379, Dogfish Head Craft Brewery, 75 Minute IPA (2012)
3647, RJ Rockers Brewing Company, Black Perle
2193, CraftHaus Brewery, Evocation Tweaked With Hibiscus
889, SLO Brewing Company, IPA
3227, Founders Brewing Co., Red's Rye IPA
1661, Bang The Drum Brewery, Das Weiss
100, Cervecería Cuauhtémoc Moctezuma S.A. de C.V., Bohemia Clásica
1810, Goose Island Beer Co., Bourbon County Brand Coffee Stout
1440, Jacob Leinenkugel Brewing Company, Summer Shandy
1706, Guinness, Smithwick’s Pale Ale
639, 21st Amendment Brewery , He Said (Belgian-Style Tripel)
2481, Drake's Brewing Company, Migrating Monkey
1194, Boston Beer Company (Samuel Adams), Samuel Adams Dunkelweizen
2730, The Libertine Pub, Oh Man
1787, Stone Brewing Co., Stone Imperial Russian Stout (2012)
3776, BrewDog, Punk IPA
1367, Beach City Brewery, Beach Cruiser
3455, Belching Beaver, Chardonnay Barrel Aged Saison
463, Stone Brewing Co., 18th Anniversary IPA
2855, Sierra Nevada Brewing Co., Vision Of Sugar Plums
260, Lagunitas Brewing Company, Olde GnarlyWine
885, Ninkasi Brewing Company, Tricerahops Double IPA
2251, Brasseries Kronenbourg, 1664
1346, Jacob Leinenkugel Brewing Company, Sunset Wheat
272, Towne Park Brew Co., IPA
341, Modern Times Beer, Black House
1943, Ritual Brewing Company, Hellion
3699, Foothills Brewing, Sexual Chocolate
942, Firestone Walker Brewing Company, Foeder #2
3697, The Lost Abbey, Angel's Share (2008)
3900, Rogue Ales & Spirits, Voodoo Doughnut Bacon Maple Ale
521, Humboldt Brewing Company, Nectar IPA
2916, Oskar Blues Brewery, Deviant Dale's
728, No-Li Brewhouse, No Boundaries
1546, Hermitage Brewing Company, 408 Session IPA
933, SLO Brewing Company, Honey Blonde
2343, Cigar City Brewpub, Brewer's Brunch Stout
2583, Societe Brewing Company, The Publican
2813, Deschutes Brewery, Green Monster
106, Brouwerij Liefmans, Fruitesse
2978, Societe Brewing Company, The Bachelor with Chinook
1565, Broken Barrel Brewing Co., Oculto
2920, Discretion Brewing, Shimmer Pils
3115, New Glarus Brewing Company, Strawberry Rhubarb
2435, Odell Brewing Co., Cutthroat Porter
2247, FrogBeer, Ginger Twist
2810, Deschutes Brewery, Conflux Series No.1: Collage
1436, Cismontane Brewing Co., Dead Santa (2014)
2131, Ritual Brewing Company, Bourbon Barrel Aged Big Deluxe (High West)
1406, Left Coast Brewing, Del Mar St.
589, New Belgium Brewing Company, Salted Caramel Brownie Brown Ale
3872, Golden Road Brewing, 329 Lager
1625, Southern Tier Brewing Company, Pumking
2431, Odell Brewing Co., Brazzle
3044, Russian River Brewing Company, Framboise For A Cure (2013)
1887, Monkey Paw Brewing Company, Sweet Georgia Brown
1398, Avery Brewing Company, Collaboration Not Litigation Ale
2629, The Libertine Pub, Summer Breeze Apricot Raspberry
3611, 21st Amendment Brewery , Ugly Sweater IPA
85, Alaskan Brewing Co., Oatmeal Stout
1612, Boston Beer Company (Samuel Adams), Samuel Adams Cold Snap
2759, Lagunitas Brewing Company, DayTime Fractional IPA (2014)
2985, Alpine Beer Company (CA), Great
2019, Central Coast Brewing, Deep Dark
2263, BarrelHouse Brewing Co, Apricot Blonde Sour | Batch No. 1402
1178, Monkish Brewing Co., Beer.HOPS.Love.
2217, House Of Pendragon Brewing Co., Dragon Juice
938, Firestone Walker Brewing Company, Unfiltered DBA (Double Barrel Ale)
1163, Abbaye de Leffe, Leffe Blonde
3114, The Lost Abbey, Track #1: Runnin' With The Devil
1938, Angel City Brewery, Orange and Cocoa Stout
1518, Wolf Creek Brewery, Full Moon Stout
2746, The Bruery, ORB: One Random Barrel
3319, Uncommon Brewers, Golden State Ale
1853, Epic Brewing Co. (Utah Colorado), Big Bad Baptist
3181, Boulder Beer Company, A Honey of a Saison
1322, AleSmith Brewing Company, IPA
2782, Central Coast Brewing, Gravenstein Apple Dry Cider
2114, Boston Beer Company (Samuel Adams), Tetravis
3510, Pizza Port Brewing Co. , Spoettie Oattie
2323, AleSmith Brewing Company, Speedway Stout (Vietnamese Coffee)
1651, Tieton Cider Works, Apricot Cider
2546, Deschutes Brewery, Jubelale (2014)
2470, Fieldwork Brewing Company, Batch 2
1508, Sierra Nevada Brewing Co., Golden IPA
3814, Santa Cruz Mountain Brewing, Slug Life
2772, The Libertine Pub, Pub Blend One
784, The Libertine Pub, Pacific Ocean Blue
3678, Drake's Brewing Company, One Bourbon_ One Scotch_ Oh Dear!
3861, Peak Organic Brewing Company, Nut Brown Ale
50, Rinkuškiai, Before-After Triple Bock
1584, New Belgium Brewing Company, Skinny Dip
3232, Karl Strauss Brewing Company, Imperial Pomegranate Berlinerweisse
1320, Four Peaks Brewing Company, Kilt Lifter
1125, Lagunitas Brewing Company, Olde GnarlyWine (2015)
2146, Boston Beer Company (Samuel Adams), Samuel Adams Utopias (2015)
3268, Hair of the Dog Brewing Company, Fred from the Wood
2837, Eight Bridges Brewing, Fyrst RIPA
1410, B. Nektar Meadery, Zombie Killer (Dry-Hopped)
2951, The Bruery, Humulus Wet: Mosaic
3762, Damn Good Brew, The Dirtiest of Blonds
3200, New Belgium Brewing Company, Trip XVI - Seattle Farmhouse Rye Ale
662, Buffalo Bill's Brewery (California), America's Original Pumpkin Ale
3440, Drake's Brewing Company, Cuvee Drakes
2427, Odell Brewing Co., Barrel Thief Oak Aged Imperial IPA
624, Karl Strauss Brewing Company, Autumn Ale
2623, Figueroa Mountain Brewing Co., Bieré De Ménage
388, Wyder's Cider, Dry Raspberry Hard Cider
1046, Stone Brewing Co., Old Guardian Barley Wine
3490, Full Circle Brewing Company, Good Ass Barleywine
3422, Brouwerij Rodenbach, Rodenbach Grand Cru
2502, Lakewood Brewing Company, Bourbon Barrel Temptress (BBT)
2904, Brouwerij Rodenbach, 2010 Vintage Oak Aged Ale (Barrel No 144)
803, Magners Irish Cider, Magners Original Irish Cider
2528, Cascade Brewing Company (USA), Vlad the Imp Aler
2816, HaandBryggeriet, Berry Blend
2229, Brouwerij Huyghe, Delirium Red
251, Thistly Cross Cider, Thistly Cross Jaggy Thistle
871, Mammoth Brewing Company, Double Nut Brown
217, Brouwerij Van Steenberge, Monk's Café Flemish Sour Ale
2139, Caledonian Brewing Company , Newcastle Bombshell
2145, Sierra Nevada Brewing Co., Bourbon Barrel Aged Maillard's Odyssey
3444, Brasserie de Silly, Scotch Silly
1136, Pizza Port Brewing Co. , Local Habitual Saison
2587, Modern Times Beer, City Of The Sun
3336, Mike Hess Brewing, Anno Duo
970, Anchor Brewing Company, Liberty Ale
3637, Magnolia Brewing Company, Sarah Hughes Rich Ruby Mild
1232, Hangar 24 Craft Brewery, Barrel Roll No. 4 - Hammerhead (2015)
3327, Jolly Pumpkin Artisan Ales, Lúpulo de Hielo
1283, Ballast Point Brewing & Spirits, Ginger Big Eye IPA
3076, Brouwerij West, Dog Ate My Homework
1960, Great South Bay Brewery, Blood Orange Pale Ale
652, Saint Archer Brewing Company, Gose
3909, Sierra Nevada Brewing Co., Nooner Session IPA
79, The Pike Brewing Company, Space Needle Golden IPA
2237, Kaapse Brouwers, Harrie
2273, Altamont Beer Works (California), Berry White
1754, Cascade Brewing Company (USA), Sang Noir
3738, Unibroue, Trois Pistoles
2960, Green Flash Brewing Co., Hamilton's 7th Anniversary Junior IPA
2069, Wiens Brewing, Big Cog DIPA
2381, Ritual Brewing Company, Big Deluxe
1291, AleSmith Brewing Company, X Extra Pale Ale
2160, Dunbar Brewing, Dunkel Fester
2514, Luna Brew, The New Black
3108, The Lost Abbey, Track #7: Devil Inside
1798, Brasserie Dupont, Monk's Stout
446, Allagash Brewing Company, Black
