id, brewery, beer
972, Goose Island Beer Co., Matilda
966, Anheuser-Busch, Bud Light
3903, Einstök Ölgerð, Arctic Berry Ale
1018, Belching Beaver, Beavers Milk
709, Brauerei Veltins, Veltins Pilsener
3835, Alvarado Street Brewery & Grill, IPL For ALS
2535, BarrelHouse Brewing Co, Berry Session Saison
226, Klosterbrauerei Andechs, Andechser Doppelbock Dunkel
179, Georgetown Trading Co, James E Pepper 1776
1191, Noble Ale Works, Walruses of London
3259, Bullfrog Brewery, OUD 15
1270, Legacy Brewing Company, Clan Ross Scotch Ale
7, Clown Shoes, Flight of the Angry Beast
3203, Stone Brewing Co., Stone 11.11.11 Vertical Epic aged in White Wine Barrels
1035, Ballast Point Brewing & Spirits, Red Wedding IPA
981, Brewery Ommegang, Three Philosophers (2014)
2106, Ritual Brewing Company, Monk's Lunch
2647, Trinity Brewing Co. (Colorado), Ten Minutes Of Pleasure
3421, Stone Brewing Co., Aleman/Two Brothers/Stone DayMan Coffee IPA
1705, Angry Orchard Cider Company, Strawman
726, Dogfish Head Craft Brewery, Sixty-One
1547, Hermitage Brewing Company, Single Hop Series: Citra
2150, Allagash Brewing Company, Farm To Face (2015)
514, Angry Orchard Cider Company, The Muse
1036, Ballast Point Brewing & Spirits, Alt Hands On Deck
296, The Libertine Pub, Amber Sour Mash
3607, Cismontane Brewing Co., Deciduous XPA
2171, Tioga-Sequoia Brewing Co. , Rush Hour - Breakfast Stout
2207, Track 7 Brewing Co., Panic IPA
2523, AC Golden Brewing Co., Hidden Barrel Apricot
3511, Green Flash Brewing Co., Silva Stout
1779, Los Gatos Brewing Company, Ryenot
3391, New Belgium Brewing Company, Biere de Garde (Lips of Faith)
667, Stone Brewing Co., Stone 12.12.12 Vertical Epic Ale
3309, Westbrook Brewing Co., Mexican Cake
2533, BarrelHouse Brewing Co, Sour Blonde Ale | Batch No. 1301
2750, Trinity Brewing Co. (Colorado), Old Growth (Batch 3)
2071, The Bruery, Golden Orchard
1264, Anaheim Brewery, Coast To Coast IPA
2276, Lagunitas Brewing Company, Fusion 30
801, Aspall, Suffolk Draught Cyder
2627, Coachella Valley Brewing Company , Desert Swarm
2570, Stone Brewing Co., Arbalest Bourbon Barrel Belgian Pale
2366, Powell Street Craft Brewery, Right Kind of Crazy
3873, Bent River Brewing Co., Uncommon Stout
2004, AleSmith Brewing Company, My Bloody Valentine
2736, Institution Ale Company, Progress Pale Series: Simcoe
1833, Stone Brewing Co., Sorry Not Sorry IPA
3131, Lagunitas Brewing Company, Fusion 17
476, Sapporo Breweries, Sapporo Premium Beer
1345, Stone Brewing Co., Stone Enjoy By 3.14.15 IPA
3557, Goose Island Beer Co., Bourbon County Brand Coffee Stout (2012)
1459, Rogue Ales & Spirits, Santa's Private Reserve Ale
2014, Victory Brewing Company, Moving Parts (MP02): The Ever-Evolving IPA
991, Moylan's Brewery, Hop Craic XXXXIPA
2552, Bang The Drum Brewery, Barleywine
1971, Uinta Brewing Company, Hop Nosh IPA
2216, Drake's Brewing Company, Aroma Prieta (2015)
132, Cismontane Brewing Co., Dos Cone Es
763, Telegraph Brewing Company, Obscura Fortis
2915, Discretion Brewing, Uncle Dave's Rye IPA
2796, Ladyface Alehouse and Brasserie, 4th Anniversary
1272, Terrapin Beer Co. , Monk's Revenge (Cabernet Barrel-Aged)
749, Brauerei Beck, Beck's
2897, The Bruery, Shegöat
3836, Alvarado Street Brewery & Grill, Duane's World IPA
2497, Founders Brewing Co., Black Rye
1052, Mendocino Brewing Company, Black Eye Ale
928, Lost Coast Brewery, Indica India Pale Ale (IPA)
1922, Three Weav3rs Brewing Company, We Saw Them Coming
3057, Grupo Modelo S.A. de C.V., Modelo Especial Chelada
1324, Alpine Beer Company (CA), Duet
1269, Anaheim Brewery, Anaheim Gold
2421, Jagged Mountain Craft Brewery, Sawatch IPA
1942, Wild Donkey Brewing Company, Double Down IPA
736, Dust Bowl Brewing Company, Black Blizzard Russian Imperial Stout
3284, Butcher's Brewing, Free Range IPA
1972, SanTan Brewing Company, Sex Panther
3526, Goose Island Beer Co., Bourbon County Brand Stout (2010)
2241, Brasseries Kronenbourg, Kronenbourg
1765, BridgePort Brewing Co., Porter
679, Tahoe Mountain Brewing Company, Citrus Gose
2469, Fieldwork Brewing Company, Morning Time
1846, Aftershock Brewing Co, Pumpkinfest Ale
392, Two Rivers Cider Company, Shiso Hot
2040, Figueroa Mountain Brewing Co., Stumbling Saint
3847, Alvarado Street Brewery & Grill, Dank Sauce
204, Craft Artisan Ales, Cluster Faux Ale
3575, Latitude 33 Brewing Company, Wet Hump
1525, Los Gatos Brewing Company, Chesapeake Porter
443, Creekside Brewing Company, Bird Of Prey IPA
1347, Golden Road Brewing, 2020 IPA
1533, Brouwerij Van Honsebrouck, Kasteel Rouge
850, Lost Coast Brewery, 25th Anniversary Ale
3152, Evil Twin Brewing, Even More Jesus
1623, Griffin Cider Works, John Little's Burley Apple Pie Cider
1638, Blue Moon Brewing Company, Mountain Abbey Ale
894, Rogue Ales & Spirits, Santa's Private Reserve Ale (2014)
2422, Jagged Mountain Craft Brewery, Sky Pond Pale Ale
2788, The Libertine Pub, Pub Blend Two
2339, Trinity Brewing Co. (Colorado), Red Swingline
3506, Terrapin Beer Co. , Moo-Hoo Chocolate Milk Stout
3417, Jester King Brewery, Commercial Suicide (Non-Farmhouse)
2642, Stone Brewing Co., Stone 15th Anniversary Escondidian Imperial Black IPA Aged In Lowland Scotch Whisky Barrels
3354, AleSmith Brewing Company, Speedway Stout (Kopi Luwak)
465, Knee Deep Brewing Company, Simtra Triple IPA
3632, Mikkeller, Invasion Farmhouse IPA
1002, Green Flash Brewing Co., Special Cuvee
520, Birra Peroni, Peroni Original
2630, Tahoe Mountain Brewing Company, Daisy Dukes
1187, Tahoe Mountain Brewing Company, Zombie Dog
3423, Iron Fist Brewing Co., Dark Days
791, Brauerei Aying , Ayinger Oktober Fest-Märzen
499, Stella Artois, Stella Artois
105, Elysian Brewing, Dark O' The Moon Pumpkin Stout
2261, Russian River Brewing Company, Row 2_ Hill 56
3756, Ballast Point Brewing & Spirits, Victory At Sea (2014 Coffee-Only Edition)
3812, Sante Adairius Rustic Ales, SARA Loves Brett #4
2610, Allagash Brewing Company, Curieux (2010)
3821, Acoustic Ales Brewing Experiment, Willow Wolves
239, Thistly Cross Cider, Thistly Cross Whisky Cask
1894, The Fat Cat Beer Company, Confession™ IPA
2264, Dunbar Brewing, Johnny Mash
3593, Brouwerij 3 Fonteinen, Schaerbeekse Kriek
813, American Hard Cider Company, Newton's Folly Granny Smith Draft Cider
2990, Arrogant Bastard Brewing Co., Double Bastard Ale (2007)
2441, Ratio Beerworks, Hold Steady W/ Coffee
1821, Electric Brewing Company, Grove For Broke Ipa
3, Belhaven Brewery, Twisted Thistle IPA
669, Red Branch Cider and Brewing Company, Hard Black Cherry
1854, Almanac Beer Co., Pumpkin Sour (2015)
2881, Uinta Brewing Company, XVII Seventeenth Anniversary Barley Wine
2946, Bootlegger's Brewery, Hop Monster
3477, Coronado Brewing Company, Bada Bing Cherry Porter
370, Heretic Brewing Company, Shallow Grave
3773, Bale Breaker Brewing, Field 41 Pale Ale
2942, Firestone Walker Brewing Company, Vessel 8 Saison
1447, Cismontane Brewing Co., Nightmare Before Santa
975, Moylan's Brewery, Dragoons Dry Irish Stout
2615, Avery Brewing Company, Samael's Oak-Aged Ale
2926, Southern Tier Brewing Company, Crème Brûlée (2013)
1863, Shipyard Brewing Company, Melonhead
1937, Sierra Nevada Brewing Co., Kellerweis
250, Deschutes Brewery, Black Butte XXVI
2658, Black Diamond Brewing Company, Rampage Imperial IPA
1918, Alosta Brewing Co., Saison Bleu
3700, Rogue Ales & Spirits, Voodoo Doughnut Chocolate_ Peanut Butter & Banana Ale
1144, Modern Times Beer, Universal Friend
1111, Green Flash Brewing Co., West Coast IPA (-2013 Retired)
1452, Saint Archer Brewing Company, White Ale
2174, Drake's Brewing Company, Jolly Rodger (2015)
3834, Eight Bridges Brewing, Hoppy Annihilation
3298, Kuhnhenn Brewing Company , Raspberry Eisbock
2210, New Belgium Brewing Company, Lips of Faith Love: Oscar
1289, AleSmith Brewing Company, Lil Devil
2129, Coronado Brewing Company, Hibiscus IPA
3505, Brooklyn Brewery, Black Chocolate Stout (2012)
2687, Beachwood Brewing, Alpha Supreme
39, Redhook Brewery, Long Hammer IPA
1401, Reverend Nat's Hard Cider, Revival
37, Heavy Seas Beer, Small Craft Warning
3618, 3 Floyds Brewing Company, Dark Lord (2008)
2437, Trinity Brewing Co. (Colorado), Pappy Legba
3324, Ballast Point Brewing & Spirits, bOOb Check Ale
2632, Sante Adairius Rustic Ales, Saison Bernice
2414, Molly Pitcher Brewing Co. (California), Molly's IPA
1030, Green Flash Brewing Co., Hop Odyssey White IPA
1515, Anderson Valley Brewing Company, Hop Ottin IPA
812, Stella Artois, Stella Artois Cidre
128, The Lost Abbey, Queen Anne's Revenge
2099, Backstreet Brewery (Lamppost Pizza), Rydin' Dirty IPA
3562, Hoppin' Frog Brewery, Sweet Evil BBW
3507, Terrapin Beer Co. , Hopsecutioner
761, Surf Brewery, Grapefruit Wahine
2530, Firestone Walker Brewing Company, SLOambic (2014)
2351, Beachwood Brewing, Un Atout
426, Firestone Walker Brewing Company, Velvet Merlin
979, House Of Pendragon Brewing Co., Merlin's Mild
2606, The Bruery, Floyd D'Rue
986, The Bruery, Oude Tart (2014)
1071, Brouwerij Van Steenberge, Gulden Draak Brewmasters Edition (2013)
2776, Telegraph Brewing Company, Cipher Key Session Ale
409, Lagunitas Brewing Company, The Hairy Eyeball (2014)
3222, Societe Brewing Company, The Bachelor with Mosaic
3008, Heretic Brewing Company, Dead Weight
1817, Alaskan Brewing Co., Heritage Coffee Brown Ale
1507, Cambria Beer Company, Coucher De Soliel
920, Lost Coast Brewery, Tangerine Wheat
3168, Stone Brewing Co., Stone 17th Anniversary Götterdämmerung IPA
554, The Lost Abbey, Gift of the Magi
3392, Oakland Brewing Co., Sticky Zipper IPA
82, Bear Republic Brewing Co., Racer 5 IPA®
2390, Oskar Blues Brewery, Shipwrecker Circus
564, Deschutes Brewery, Chasin' Freshies
2688, Ladyface Alehouse and Brasserie, Hop Project Lupulus Rabbit
2755, Bottle Logic Brewing, Calf Life
3652, Stone Brewing Co., Stone 10.10.10 Vertical Epic Ale
1914, Phantom Carriage, Vermiste Kat
115, Brouwerij St. Bernardus, St. Bernardus Abt 12
2495, Southpaw BBQ and Southern Cooking, Smoked Pecan Barleywine
2454, AleSmith Brewing Company, San Diego Pale Ale .394
708, Lagunitas Brewing Company, DayTime Fractional IPA
875, Bear Republic Brewing Co., Apex™
3001, Dogfish Head Craft Brewery, American Beauty
969, Coronado Brewing Company, Idiot IPA
99, Sierra Nevada Brewing Co., Pale Ale
3058, Green Flash Brewing Co., Hop Odyssey Symposium IPA
1118, Bayerische Staatsbrauerei Weihenstephan, Weihenstephaner Festbier
2158, Heretic Brewing Company, Hibiscus Agony
2811, The Lost Abbey, Sede Vacante Ale
1249, Homebrew, Cider
3853, Woodstock Inn Brewery, Pemi Pale Ale
345, Green Flash Brewing Co., Palate Wrecker (2014)
848, Oskar Blues Brewery, Pinner Throwback IPA
3007, Heretic Brewing Company, Gramarye
3301, FiftyFifty Brewing Co., Rouge Baril Baltique
467, Stone Brewing Co., Unapologetic IPA
2660, Stone Brewing Co., Passion Project
779, BridgePort Brewing Co., Stumptown Tart (2015)
1808, The Bruery, Chocolate Rain (2015)
2650, House Of Pendragon Brewing Co., Dry Hopped French Saison
676, Saint Archer Brewing Company, IPA
36, Goose Island Beer Co., 312 Urban Wheat Ale
2524, The Bruery, Mischmishmish
2691, Stone Brewing Co., Stone Enjoy By 07.04.14 IPA
2078, Black Market Brewing Co., Shakedown 
1520, Telegraph Brewing Company, Oatmeal Stout
687, New Belgium Brewing Company, Slow Ride
2768, Steelhead Brewing Co., Bombay Bomber IPA
2342, Wicked Weed Brewing, Amorous
2159, FiftyFifty Brewing Co., B.A.R.T. (Barrel Aged Really Tasty) with Coffee
2000, Clown Shoes, Date Night
2425, Great Divide Brewing Company, Yeti
2116, Craft Brewing Company, Raven Stout
2584, The Libertine Pub, Brett Proof
747, Paulaner Gruppe, Oktoberfest Märzen (USA Only)
1988, Green Flash Brewing Co., Soul Style
2318, De Struise Brouwers, Black Damnation III - Black Mes
2509, The Bruery, Chocolate Rain
2434, New Belgium Brewing Company, Cocoa Mole (2015)
252, Deschutes Brewery, Pine Mountain Pilsner
1636, Blue Moon Brewing Company, Caramel Apple Spiced Ale
2065, New Belgium Brewing Company, Pumpkick
2370, Cascade Brewing Company (USA), Bourbonic Plague
2230, Smuttynose Brewing Co., Kindest Find
3163, Sierra Nevada Brewing Co., Flipside Double IPA
151, Great Divide Brewing Company, Old Ruffian
203, Napa Smith Brewery, Organic IPA
654, Stone Brewing Co., Stone Enjoy By 11.27.15 Black IPA
3204, Port Brewing Company, Santa's Little Helper - Bourbon Barrel Aged (2011)
3022, Full Circle Brewing Company, Russian Imperial Stout
1719, Lagunitas Brewing Company, Wilco Tango Foxtrot (WTF)
1442, Coors Brewing Company, Third Shift - Amber Lager
1544, Hermitage Brewing Company, Hoptopia Double IPA
2277, Sante Adairius Rustic Ales, West Ashley
2634, Sante Adairius Rustic Ales, Little Quibble
3631, Stone Brewing Co., Stone 16th Anniversary IPA
2940, Figueroa Mountain Brewing Co., Magpie Porter Petite Syrah Barrels
3342, 3 Floyds Brewing Company, Dark Lord (Pappy Van Winkle Barrel Aged) (2011)
1847, Aftershock Brewing Co, PB&J Bay
2036, Central Coast Brewing, A La Tart
887, Anchor Brewing Company, Old Foghorn (2014)
266, Tahoe Mountain Brewing Company, Cocotart
2789, Societe Brewing Company, The Bachelor with Azacca
3570, Uncommon Brewers, Bacon Brown Ale
603, Tap It Brewing Co, IPA (India Pale Ale)
440, Anchor Brewing Company, Anchor Steam Beer
3868, Chameleon Brewing, Witty
3595, Sierra Nevada Brewing Co., Narwhal Imperial Stout (2012)
776, Clown Shoes, Blaecorn Unidragon
3393, Calicraft Brewing Co., Oak Town
1630, Carlsberg Group, Tuborg Gold
916, Dogfish Head Craft Brewery, Midas Touch (2014)
1697, Widmer Brothers Brewing, Alchemy Ale
1140, Brewery Ommegang, Fleur de Houblon (Summer Ale)
3217, 3 Floyds Brewing Company, Alpha King
3546, Stone Brewing Co., Stone Enjoy By 02.15.13 IPA
2582, Strand Brewing Co., Expression Session
590, Almanac Beer Co., Almanac IPA
2186, Bear Republic Brewing Co., Pace Car Racer™
1529, Ninkasi Brewing Company, Wünderbier
2534, BarrelHouse Brewing Co, Sour Amber Ale | Batch No. 1302
1670, Sierra Nevada Brewing Co., Electric Ray
3658, Stone Brewing Co., Stone 02.02.02 Vertical Epic Ale
3904, Black Diamond Brewing Company, Free Style Belgian Blonde
1298, Stadium Brewing Company, Amarillo Throw Down
3741, Creekside Brewing Company, Phoenix IPA
1379, Left Coast Brewing, Snivler
921, Lagunitas Brewing Company, The Hairy Eyeball
3653, Stone Brewing Co., Stone 07.07.07 Vertical Epic Ale
3331, Bell's Brewery Inc., Oarsman Ale
2346, The Alchemist, Heady Topper
337, Karl Strauss Brewing Company, Red Trolley Ale
133, Cismontane Brewing Co., Black's Dawn
286, Kern River Brewing Company, Just Outstanding IPA
893, Foster's Group, Foster's Lager
487, Sierra Nevada Brewing Co., There and Back
3321, Automatic Brewing Co., Saison De Lyla
2433, New Belgium Brewing Company, Yuzu (Lips of Faith)
2836, Brasserie Cantillon, Classic Gueuze (2013)
2807, Hoppin' Frog Brewery, Barrel Aged B.O.R.I.S. Oatmeal Imperial Stout
951, Firestone Walker Brewing Company, PNC - Tequila Barrel-Aged Imperial Buckwheat Stout (2013)
2866, Mad River Brewing Company, Steelhead Bourbon Barrel Aged Extra Stout
957, Bierbrouwerij De Koningshoeven, La Trappe Quadrupel
342, Stone Brewing Co., Stone Enjoy By 02.14.15 IPA
3300, Firestone Walker Brewing Company, Firestone 10 Anniversary Ale
3258, Brasserie Cantillon, Lou Pepe Framboise (2005)
2957, Shipyard Brewing Company, Pumpkinhead Ale
2375, The Lost Abbey, Cuvee de Tomme (2010)
1497, Resignation Brewery, KCCO Black Lager
2906, New Belgium Brewing Company, Rewind IPA (Hop Kitchen)
2066, Redstone Meadery, Black Folie
454, The Libertine Pub, Turkey Buzzard
494, 21st Amendment Brewery , Back in Black
2896, The Bruery, Mischief Gone Wild
84, Altamont Beer Works (California), Hella Hoppy
2976, AleSmith Brewing Company, Speedway Stout (Vietnamese Coffee & Peanut Butter)
3797, Selkirk Abbey, Saint Thomas
1223, Flat Tail Brewing, Tailgator
946, Firestone Walker Brewing Company, Feral Vinifera
2253, Ladyface Alehouse and Brasserie, Red Rye
3603, Epic Brewing Co. (Utah Colorado), Brainless® on Peaches
797, The Lost Abbey, Avant Garde
2565, Hollister Brewing Company, Shaky Hands
2595, Hollister Brewing Company, LemonAle
2191, CraftHaus Brewery, Centerpiece
1273, Legacy Brewing Company, That Guava Beer
1979, Societe Brewing Company, The Harlot
3133, Lagunitas Brewing Company, SoCo Stout
3804, Altamont Beer Works (California), Maui Waui IPA
1371, Tap It Brewing Co, Continuum
3705, FiftyFifty Brewing Co., Eclipse - Elijah Craig 20 (2011)
2222, De Proefbrouwerij, La Marise
2518, Brasserie Cantillon, Classic Gueuze
671, Kona Brewing Company, Longboard Island Lager
131, Ritual Brewing Company, Big Deluxe (2013)
1620, Great Lakes Brewing Company , Dortmunder Gold
2507, Alpine Beer Company (CA), Pure Hoppiness
2912, New Belgium Brewing Company, Patagonia California Route
3735, Schlossbrauerei Herrngiersdorf, Publiner
508, Allagash Brewing Company, Tripel
2690, Saint Somewhere Brewing Company, Saison Athene
1522, Boston Beer Company (Samuel Adams), Samuel Adams White Christmas
1257, El Segundo Brewing Company, Hammerland DIPA
1950, Brooklyn Brewery, Brooklyn Sorachi Ace
607, Figueroa Mountain Brewing Co., 3rd Anniversary
354, Goose Island Beer Co., Goose IPA
1594, Hofbrauhaus Wolters, Peter's Brand Classics
2917, Discretion Brewing, Good Faith
349, Deschutes Brewery, The Abyss (2013)
995, Stone Brewing Co., RuinTen IPA (2014)
1332, Greene King, Wexford Irish Cream Ale
1730, Uinta Brewing Company, Dubhe Imperial Black IPA
2607, 3 Floyds Brewing Company, Zombie Dust
706, Old Redwood Brewing Company, The Compromise
845, Tap It Brewing Co, Berliner Weisse
3615, Elysian Brewing, Bifröst Winter Ale
3048, The Libertine Pub, Ruby Slipper
2600, Dogfish Head Craft Brewery, Noble Rot (2014)
2312, Terrapin Beer Co. , French Toasted W-n-B Coffee Oatmeal Imperial Stout
1772, The Commons Brewery, Urban Farmhouse
3752, Council Brewing Company, Beatitude Raspberry Tart Saison
1916, Phantom Carriage, Pleasance
1251, Tahoe Mountain Brewing Company, Lupi Lounge
2292, Drake's Brewing Company, IPA
1017, The Lost Abbey, Judgment Day
1128, The Bruery, Arrrggghhh!
2152, Stone Brewing Co., Stochasticity Project: Grainiac
884, Stone Brewing Co., Stone Ruination IPA
955, Brouwerij Liefmans, Liefmans Cuvée Brut
1957, Sixpoint Brewery, Sweet Action
2119, Unión de Cervecerías Peruanas Backus y Johnston, Cusqueña Dorada Golden Lager
1067, Hangar 24 Craft Brewery, California Spring Beer
1438, Lagunitas Brewing Company, Fusion 22
2259, Golden City Brewery, Evolution IPA
2923, Telegraph Brewing Company, Gypsy Ale
2324, Jester King Brewery, Ol' Oi!
2681, Crooked Stave Artisan Beer Project, Nightmare On Brett (Grand Cru)
2275, Sante Adairius Rustic Ales, Anaïs
2678, Cascade Brewing Company (USA), Franken'ly Berry
3197, Alaskan Brewing Co., Smoked Porter (2012)
3172, Stone Brewing Co., Stone Ruination IPA - Tropical Heat Edition
1716, Stone Brewing Co., Barrel Aged Brown Ale w/ Balaton Sour Cherries
3126, Surly Brewing Company, Furious
2234, 3 Floyds Brewing Company, Majsgoop
3315, Stone Brewing Co., Stone 12th Anniversary Bitter Chocolate Oatmeal Stout
3635, Magnolia Brewing Company, Proving Ground IPA
1652, Finnriver Farm & Cidery, Sparkling Black Currant Cider
3465, Widmer Brothers Brewing, SXNW
371, Stone Brewing Co., Xocoveza Mocha Stout
1400, Brouwerij Alken-Maes, Maes Pils
922, Magic Hat Brewing Company, #9
1070, Trader Joe's (JosephsBrau), Black Toad
1203, Pizza Port Brewing Co. , Death Star
2932, Bear Republic Brewing Co., Black Racer™
2023, Inland Empire Brewing Company, Rivertucky 2013 Reserve Series Barleywine Aged In Oak Bourbon Barrels
2164, Deschutes Brewery, EHOP
2933, Hangar 24 Craft Brewery, Local Fields: Kirschen
2574, Drake's Brewing Company, La Resistance (Barrel Aged)
3732, Sprecher Brewing Company, Special Amber
1770, BridgePort Brewing Co., Trilogy 3
112, Deschutes Brewery, Jubelale
2138, Deschutes Brewery, Mirror Mirror (2009)
1097, Central Coast Brewing, Double Stenner Creek Stout
1445, Cismontane Brewing Co., Santa's Beard
2848, Cellarmaker Brewing Company, J-17 Pale Ale
1381, Left Coast Brewing, Hop Juice
2701, Alpine Beer Company (CA), Keene Idea
1578, Redhook Brewery, ESB
3016, New Belgium Brewing Company, Fresh Hop India Pale Ale (Hop Kitchen)
2111, Coronado Brewing Company, Barrel Aged Stupid Stout
3153, Evil Twin Brewing, Aún Más Café Jesús
2803, Hangar 24 Craft Brewery, Local Fields Series: Polycot
3106, The Lost Abbey, Track #8: Number Of The Beast
190, Palo Alto Brewing Company, Hoppy Ending
1377, Pizza Port Brewing Co. , The New Guy (San Clemente)
3248, Logsdon Farmhouse Ales, Seizoen Bretta
2739, Ladyface Alehouse and Brasserie, Chesebro IPA
1284, Ballast Point Brewing & Spirits, Single Hop Simcoe Dark IPA
992, North Coast Brewing Company, Acme California Pale Ale
2451, Hollister Brewing Company, Hippie Kicker
628, Noble Ale Works, Tongue Tickles
3194, Cigar City Brewing, Cucumber Saison
2349, The Alchemist, Petit Mutant
2426, Odell Brewing Co., Fifty Niner
3863, Rogue Ales & Spirits, Morimoto Soba Ale
1135, Moonlight Meadery, Wet N' Wild
2438, Odell Brewing Co., 90 Shilling
3339, Rahr & Sons Brewing Company, Ugly Pug
2585, Alpine Beer Company (CA), Bine & Vine 3rd Anniversary Ale
3771, BrewDog, Hardcore IPA
2137, The Bruery, Batch 1000 Bryeian
2704, Surly Brewing Company, Darkness (2013)
3706, Arrogant Bastard Brewing Co., Punishment
1629, Port Brewing Company, Santa's Little Helper
1952, Finback Brewery, Lazy Ax
2733, Stone Brewing Co., Smoked Porter With Kongo Coffee And Orange Peel
3543, Middle Ages Brewing, Wailing Wench
3148, Surly Brewing Company, Coffee Bender
1241, Cismontane Brewing Co., 5th Anniversary 5 Grain Saison
1431, Brewery Ommegang, Rare Vos
2365, Toolbox Brewing Company, Virgin Cherry Sour Blonde Wild Ale w/ Cherries
3683, Brasserie Cantillon, Zwanze (2012)
1757, Cascade Brewing Company (USA), Bourbon Cointreau
2955, Dogfish Head Craft Brewery, Immort Ale
3409, Craftsman Brewing Company, Persimmon Sour
452, Echigo Beer Co., Stout
3202, Coronado Brewing Company, Frog's Breath IPA
3239, Port Brewing Company, Amigo Lager
2919, Discretion Brewing, 4th Conversation
2260, Ballast Point Brewing & Spirits, Serrano Pepper Pale Ale
1242, Firestone Walker Brewing Company, Stickee Monkee
3813, Sante Adairius Rustic Ales, Simpleton
215, Caldera Brewing Company, Pilot Rock Porter
2598, Dogfish Head Craft Brewery, Immort Ale (2013)
2608, Widmer Brothers Brewing, Gentlemen's Club Rye Whiskey
515, Stone Brewing Co., RuinTen Triple IPA
1644, Central Coast Brewing, Lucky Day IPA
3378, Societe Brewing Company, The Bachelor with Centennial
1467, Cismontane Brewing Co., Marea Roja
3243, Coronado Brewing Company, Peanut Butter Stout
1358, Sierra Nevada Brewing Co., Nooner Pilsner
2726, Drake's Brewing Company, Mind Trick (Sour)
319, Stone Brewing Co., Matt's Burning Rosids
1587, Shock Top Brewing Co., Honeycrisp Apple Wheat
2719, Sierra Nevada Brewing Co., Rauchbier
3580, Rock Bottom Restaurant & Brewery, Dragon Slayer
3278, Stone Brewing Co., Liberty Station Witty Moron
2393, New Belgium Brewing Company, Lightning In A Bottle
2468, Howe Sound Brewing, Megadestroyer Imperial Licorice Stout
3788, Indian Wells Brewing Company, Mojave Red
1671, Sierra Nevada Brewing Co., Alt Route
2828, Beachwood Brewing, Kilgore
108, Brouwerij Lindemans, Apple
2597, Lengthwise Brewing Company, Zeus Imperial Ale
274, Stadium Brewing Company, Blueberry Lager
3431, Monkey Paw Brewing Company, Valentine's Ale
3081, Breckenridge Brewery, 471 Small Batch IPA
2046, Solvang Brewing Company, Valhalla IPA
1215, Stone Brewing Co., Ruination 2.0 Double Dry Hopped
868, Tap It Brewing Co, Cafe Noir
1645, Central Coast Brewing, Golden Glow
3193, The Bruery, Black Tuesday (2011)
3353, Creekside Brewing Company, Cascadian Dark Ale
990, Sudwerk Brewing Co., Fünke Hop Farm
2637, Bootlegger's Brewery, Rustic Rye IPA
1437, Rogue Ales & Spirits, Double Dead Guy Ale
2219, House Of Pendragon Brewing Co., Bannerman Session IPA
2047, Black Market Brewing Co., Holiday Ale
3472, Pizza Port Brewing Co. , Draft Punk (San Clemente)
1860, Bell's Brewery Inc., Special Double Cream Stout
1554, Speakeasy Ales & Lagers, Tallulah Extra Pale Ale
3760, Monterey Coast Brewing Co, Chocolate Porter
2021, Three Weav3rs Brewing Company, Midnight Flight
1285, Ballast Point Brewing & Spirits, Wahoo White w/ Thai Chili_ Lime_ & Ginger
364, Figueroa Mountain Brewing Co., Big Cone Black Ale
1220, Victory Brewing Company, Summer Love
182, Boulevard Brewing Co., Tell-Tale Tart
2400, Golden Road Brewing, Saison Citron
2825, New Belgium Brewing Company, Biere De Mars (Lips of Faith)
2288, Societe Brewing Company, The Bachelor With Galaxy
780, Drake's Brewing Company, Aroma Coma
1849, Garage Brewing Co, Thai Chili IPA
846, Tap It Brewing Co, Full Blown Stout
3246, Societe Brewing Company, The Madam
162, The Lost Abbey, House Sour
3161, Great Divide Brewing Company, Barrel Aged Hibernation Ale (2011)
1479, Modern Times Beer, Fortunate Islands
1303, The Bruery, Or Xata (2015)
3687, The Lost Abbey, Cable Car Ale
2740, Ladyface Alehouse and Brasserie, Ladyface IPA
2128, Dogfish Head Craft Brewery, Miles Davis' Bitches Brew
1362, Tahoe Mountain Brewing Company, Provisions 
821, Brasserie Dupont, Saison Dupont Cuvée Dry Hopping (2015)
2859, Sierra Nevada Brewing Co., Audition Chocolate Creme Stout
3093, Brash Brewing Company, Smoglifter
1413, Ritual Brewing Company, Hop-O-Matic
2554, High Water Brewing, Le Petit Diablotin
863, Black Ty Brewing, TNA Passionate Orange Mango Candy Ale
1092, Strike Brewing Company, Horn Rounder IPA
1776, Green Flash Brewing Co., Linchpin White IPA
1761, Breakside Brewery, Breakside IPA
1877, Left Coast Brewing, Pink Bikini
2057, Hangar 24 Craft Brewery, Barrel Roll No. 4 - Hammerhead (2014)
289, Private Landbrauerei Schönram, Schönramer Weißbier
2179, Central Coast Brewing, Monterey Street
1142, Shmaltz Brewing Company, He'Brew Reunion Ale (2015)
2132, De Proefbrouwerij, Tropical Tripel
1196, Barley Forge Brewing Co., Don Perfecto
638, Almanac Beer Co., Dark Pumpkin Sour
2311, Institution Ale Company, Sedation
