id, brewery, beer
2835, Brasserie Dieu du Ciel, Pénombre
661, Anchor Brewing Company, Anchor California Lager
458, Ballast Point Brewing & Spirits, Sculpin IPA
1427, Cismontane Brewing Co., The Mesa
738, Goose Island Beer Co., Bourbon County Brand Stout
2870, Creekside Brewing Company, Sour Spiced Ale (2011)
3244, Bear Republic Brewing Co., Global Kolsch
856, BJ's Restaurant and Brewhouse, Tatonka® Stout
1728, Bang The Drum Brewery, Kumquat Saison
665, Sprecher Brewing Company, Czar Brew - Russian Imperial Stout Aged In Oak Bourbon Barrels
1606, New Belgium Brewing Company, 1554
2694, 21st Amendment Brewery , Personality Crisis
3610, Panil Birrificio Torrechiara, Panil Barriquée
1137, Green Flash Brewing Co., Imperial IPA (2015)
265, Lagunitas Brewing Company, Lagunitas Sucks
2059, Avery Brewing Company, The Reverend
3121, New Glarus Brewing Company, Serendipity
1145, Brasserie d'Achouffe, Houblon Chouffe
1608, Full Sail Brewing Company, Wassail
2781, Mammoth Brewing Company, Epic IPA
3380, Beachwood Brewing, The Falcon
1089, Tied House Brewery & Cafe, Vow of Silence
3267, Acoustic Ales Brewing Experiment, Run For The Hills
3302, Weyerbacher Brewing Company, Riserva (2011)
3468, Brasserie Cantillon, Lou Pepe Kriek (2004)
1357, Firestone Walker Brewing Company, Double DBA
249, Thistly Cross Cider, Thistly Cross Real Ginger
498, Latrobe Brewing Co., Rolling Rock Amber Lager
516, Sierra Nevada Brewing Co., Ruthless Rye IPA (2014)
455, The Bruery, Tart of Darkness (2014)
2034, Central Coast Brewing, The Original Chai Ale
634, Bottle Logic Brewing, Joule Thief
1412, Allagash Brewing Company, Fluxus (2014)
1261, Bottle Logic Brewing, Ocularity
3009, Jacob Leinenkugel Brewing Company, Big Eddy Wee Heavy Scotch Ale (2012)
865, Sierra Nevada Brewing Co., Bigfoot
3581, Automatic Brewing Co., Vanilla Blactagon
2278, Dunbar Brewing, Scottish Heavy
1238, Cervecería Cuauhtémoc Moctezuma S.A. de C.V., Sol
1334, Rinkuškiai, Werewolf
1119, Boston Beer Company (Samuel Adams), Samuel Adams Fat Jack Double Pumpkin
1484, Pizza Port Brewing Co. , Cotton's (San Clemente)
2401, Firestone Walker Brewing Company, Bretta Rosé (Batch 2)
2847, Drake's Brewing Company, Jolly Rodger 2012 (Bourbon Barrel Aged)
3887, Toro Creek Brewing Company, Red Ale
1172, Oskar Blues Brewery, GUBNA Imperial IPA
2970, AleSmith Brewing Company, Speedway Stout (Turkish Coffee & Cardamom)
255, Bootlegger's Brewery, Knuckle Sandwich
3329, Logsdon Farmhouse Ales, Peche 'n Brett
138, The Bruery, Smoking Wood Rye Whiskey Barrel Aged
3882, Fire Island Beer Company, Lighthouse Ale
41, The Libertine Pub, Pub Blend 3
2478, FiftyFifty Brewing Co., Eclipse - Evan Williams (2012)
796, King Harbor Brewing Company, Abel Brown
2721, Sierra Nevada Brewing Co., Kolsch Test Dummies
2503, Kern River Brewing Company, Citra
2581, Trinity Brewing Co. (Colorado), Damn It Feels Good To Be A Gangsta
3364, The Lost Abbey, Red Poppy Ale (2012)
1370, Midnight Sun Brewing Co., Panty Peeler
1816, Firestone Walker Brewing Company, Crimson Peak
3811, Fieldwork Brewing Company, Farmhouse Wheat
3209, Prairie Artisan Ales, Prairie Hop
996, 2 Towns Ciderhouse, Cherried Away
718, No-Li Brewhouse, Rise And Grind
2134, Bootlegger's Brewery, Pumpkin Ale
959, Redhook Brewery, Out of Your Gourd
2817, New Belgium Brewing Company, Transatlantique Kriek (2009)
1032, Stone Brewing Co., Keri Kelli/Kyle Hollingsworth/Stone Collective Distortion IPA
1892, Sudwerk Brewing Co., Farmers Market Citrus Gose Lager
613, Warsteiner, Warsteiner Weihnacht / Winter
1723, Firestone Walker Brewing Company, Bretta Weisse (2014)
2061, Hofbräuhaus Traunstein, Oktoberfest Lager
1444, Hair of the Dog Brewing Company, Blue Dot
480, Hangar 24 Craft Brewery, Local Fields Series: Vinaceous
1382, Left Coast Brewing, The Wedge
3219, Monkey Paw Brewing Company, LoveLike Beer
2252, Ladyface Alehouse and Brasserie, Picture City Porter
1963, Heartland Brewery, Red Rooster Ale
948, Firestone Walker Brewing Company, Firestone 13 Anniversary Ale
1500, Marin Brewing Company, Mt. Tam Pale Ale
172, Almanac Beer Co., Meyer Lemon Gose
3471, Kuhnhenn Brewing Company , Winter Wonder Lager (2007)
2368, Four Winds Brewing, Juxtapose
3660, Monkey Paw Brewing Company, Monkey Gose Bananas
608, Brouwerij Huyghe, Delirium Noël
551, Amstel Bier, Amstel Light
3438, Drake's Brewing Company, Brettamber
491, Trumer, Trumer Pils
1564, Strike Brewing Company, Lumber Buster American Brown Ale
1660, Sonoma Cider, The Anvil Bourbon Cider
3528, Swamp Head Brewery, Saison du Swamp
1898, Bagby Beer Company, Priscilla
1260, Brouwerij Van Steenberge, Piraat Triple Hop
1074, Allagash Brewing Company, Curieux
3334, Alpine Beer Company (CA), Odin's Raven (Bourbon Barrel Aged) (2012)
2808, Deschutes Brewery, Jubel (2010)
1717, Rip Current Brewing Co., Impact Zone
1809, Bang The Drum Brewery, Nebula
477, Shock Top Brewing Co., Honey Bourbon Cask Wheat
2671, Hoparazzi Brewing Co., Mission Impechable
384, Bison Brewing Co., Organic Chocolate Stout
3520, Karl Strauss Brewing Company, Parrot In A Palm Tree Holiday Baltic Porter
61, Crispin Cider Company, Original Cider
587, Avery Brewing Company, Zwickel Joe's
3657, Stone Brewing Co., Stone 03.03.03 Vertical Epic Ale
143, The Bruery, Bruer-Aide
3727, The Libertine Pub, Saison
1003, Green Flash Brewing Co., Citra Session IPA
321, Firestone Walker Brewing Company, Parabola (2014)
961, Stone Brewing Co., Stochasticity Project: Hibiscusicity
438, Bulmers Cider, Strongbow Honey & Apple Cider
3786, Indian Wells Brewing Company, Whiskey Barrel Amber
2842, Drake's Brewing Company, Red Eye
3484, Steelhead Brewing Co., Poor Richards Ale
3384, Founders Brewing Co., Kentucky Breakfast Stout (KBS)
953, Firestone Walker Brewing Company, Stickee Monkee (2013)
642, Main Street Brewery (Lamppost Pizza) (California), Bishop's Tipple Trippel
235, Mother Earth Brew Co. (California), Pin Up Pale Ale
3429, Monkey Paw Brewing Company, Downs Family Irish Stout (w/ Coffee & Blueberries)
2993, Arrogant Bastard Brewing Co., Double Bastard Ale (2005)
1290, AleSmith Brewing Company, Nut Brown Ale (Barrel Aged w/ Coconut)
3414, Monkey Paw Brewing Company, The Missing Link
3253, Automatic Brewing Co., Handlebar DIPA
3582, Automatic Brewing Co., Coffee Blactagon
689, Sierra Nevada Brewing Co., Beer Camp #99 - India Farmhouse Ale
712, Gordon Biersch Brewery & Restaurant, Kombinator IPL
3095, Coronado Brewing Company, 17th Anniversary
434, Spoetzl Brewery, Shiner Wild Hare Pale Ale
1275, Saint Archer Brewing Company, Imperial Porter
70, Central Coast Brewing, Quarantine
1355, Brasserie d'Orval, Orval
2412, Coppertail Brewing Company, Unholy Trippel
3672, Pizza Port Brewing Co. , Ocean Beach 125th Anniversary (Ocean Beach)
472, Gordon Biersch Brewing Company, Märzen
3718, M.Special Brewing Company, The Greatland Special IPA
2753, Lagunitas Brewing Company, Fusion 19 - Couch Trippin'
1034, Pizza Port Brewing Co. , Pint Project Saylor’s IPA (San Clemente)
3656, Stone Brewing Co., Stone 04.04.04 Vertical Epic Ale
2144, Champion Brewing Company, Tart Berliner Weisse
1195, Boston Beer Company (Samuel Adams), Samuel Adams Harvest Pumpkin Ale
2030, Goose Island Beer Co., Pepe Nero
688, Ace Cider (The California Cider Company), Ace Perry Cider
3910, Santa Maria Brewing Co., Pale Ale
3006, Heretic Brewing Company, Tartuffe
3363, Cascade Brewing Company (USA), Kriek Ale (2011)
693, John Smiths, Newcastle Brown Ale
2493, Marin Brewing Company, Al's Not Here_ Man
2971, AleSmith Brewing Company, Speedway Stout (Macadamia Nut)
2299, Sierra Nevada Brewing Co., Hoptimum (2015)
180, De Halve Maan, Straffe Hendrik Brugs Quadrupel Bier 11°
1577, Rogue Ales & Spirits, Chocolate Stout
644, Dogfish Head Craft Brewery, 60 Minute IPA
1408, United Breweries (India), Kingfisher Premium Lager
3290, The Bruery, Sour in the Rye (Kumquats)
3220, Societe Brewing Company, The Roustabout
1597, Knee Deep Brewing Company, Citra Extra Pale Ale
3176, ManRock Brewing Co., Rabid Reaper
415, Henney's, Vintage Cider (2012)
387, Ninkasi Brewing Company, Sleigh'r Dark Doüble Alt Ale
3906, Rip Current Brewing Co., Lupulin Lust
2622, New Belgium Brewing Company, Kick (Lips of Faith)
3852, 16 Mile Brewing Company, Blues' Golden Ale
1239, Baltika Breweries, Baltika #9 Extra
1435, Bières de Chimay (Abbaye Notre Dame de Scourmont) , Chimay Blanche (Cinq Cents)
2027, Iron Fist Brewing Co., Dubbel Fisted
566, Rockmill Brewery, Cask Aged Tripel
1715, Brouwerij St. Bernardus, Abt 12 (2015)
903, Boulevard Brewing Co., The Sixth Glass
3433, Brewery John Martin & Brewery Timmermans, Timmermans Pumpkin Lambicus
1424, Pizza Port Brewing Co. , Zwickel
3495, Automatic Brewing Co., Blactagon
1124, Epic Brewing Co. (Utah Colorado), Smoked and Oaked
3062, Harpoon Brewery, Harpoon IPA
3011, The Bruery, Mélange No. 3
1731, Neshaminy Creek Brewing Company , J.A.W.N. Juicy Ale With Nugget
3450, Rip Current Brewing Co., Tube Rye-der Session IPA
1966, Ninkasi Brewing Company, Dawn of the Red
1726, Bang The Drum Brewery, Double English Maple Brown Ale
3584, Russian River Brewing Company, Erudition
537, Stone Brewing Co., Stone Sublimely Self-Righteous Black IPA
1591, Ol' Burro Brewery, Tap 79 IPA
1683, Cervecería Cuauhtémoc Moctezuma S.A. de C.V., Carta Blanca
787, Sierra Nevada Brewing Co., Ovila Dubbel Barrel Aged (2015)
2246, Brouwerij Van Honsebrouck, St. Louis Premium Faro
3043, Sierra Nevada Brewing Co., Narwhal Imperial Stout (2013)
1302, New Belgium Brewing Company, Shift
944, Firestone Walker Brewing Company, Sucaba (2013)
2830, Iron Fist Brewing Co., The Resistance
2165, Fieldwork Brewing Company, Ancient Mariner
2850, Cellarmaker Brewing Company, Saison Francisco
372, Allagash Brewing Company, White
3889, Barrel Trolley Brewing, Barrel Trolley Belgian White
1121, Brouwerij Martens , Josef Belgian Blonde Ale
1063, Central Coast Brewing, Superstitious
1769, BridgePort Brewing Co., India Pale Ale
2384, W Brewery, Clovis Independence Ale
3241, Monkey Paw Brewing Company, Jimbo's Ale
256, The Bruery, Trade Winds Tripel
1927, Ladyface Alehouse and Brasserie, Trébuchet Golden Farmhouse Ale
2415, Firestone Walker Brewing Company, Double Cream Merlin Stout
783, The Libertine Pub, Gouden Foeder
2340, DuClaw Brewing Company, Sweet Baby Jesus!
3060, Weyerbacher Brewing Company, Double Simcoe IPA
1115, Russian River Brewing Company, Perdition
2161, Central Coast Brewing, Stop Collaborate & Listen
1793, Boston Beer Company (Samuel Adams), Samuel Adams Imperial White
1729, North Coast Brewing Company, Old Stock Ale Cellar Reserve (2011)
594, Guinness, Guinness Blonde American Lager
1246, Artifex Brewing Company, Rye-diculous
3040, SweetWater Brewing Company , Crank Tank Rye'd Ale
880, Deschutes Brewery, Obsidian Nitro Stout
3175, ManRock Brewing Co., Bourbon Bit_ REAPER BOUND
3180, Automatic Brewing Co., Bones Brown
3407, Marin Brewing Company, Wimpy's IPA
346, Hangar 24 Craft Brewery, Barrel Roll No. 3 - Pugachev's Cobra (2014)
3676, Stone Brewing Co., "The Perfect Crime"
3667, Pacific Beach AleHouse, Promiscuous IPA
399, Greene King, Morland Old Speckled Hen
543, Stone Brewing Co., Spröcketbier (Black Rye Kölsch)
338, Firestone Walker Brewing Company, Union Jack IPA
1924, Beachwood Brewing, System Of A Stout
2480, Central Coast Brewing, Hop Rocket Catch 23
3497, Deschutes Brewery, The Dissident (2010)
2070, The Bruery, Atomic Kangarue
3359, Pismo Brewing Company, Roadster Red Ale
1295, Stadium Brewing Company, Amber Ale
841, W Brewing, 559 CBA (Chevy BelAir Ale)
123, Almanac Beer Co., Emperor Norton
3897, Bison Brewing Co., Hop Cuvée
3523, Lawson's Finest Liquids, Hopzilla
2659, Hangar 24 Craft Brewery, 6th Anniversary Farmhouse Saison
1658, Shipyard Brewing Company, Applehead
2392, Perrin Brewing Company, Cornlaboration
816, Hornsby's Pubdrafts, Crisp Apple
817, William's Orchards, Dragon's Breath
1570, Anacapa Brewing Company, Seaward Golden 
1777, Sierra Nevada Brewing Co., Hoptimum (2014)
547, North Coast Brewing Company, Brother Thelonious
3460, Anheuser-Busch, Budweiser Black Crown
3031, Crooked Stave Artisan Beer Project, St. Bretta (Fall)
3338, Hollister Brewing Company, Southern Chaos
3665, Rough Draft Brewing Company, Amber Ale
3216, Great Lakes Brewing Company , Blackout Stout
2344, Wicked Weed Brewing, Serenity
1904, Left Hand Brewing Company, Good Juju
2423, Great Divide Brewing Company, Espresso Oak Aged Yeti
3183, Mad River Brewing Company, Humboldt Haze
3026, Track 7 Brewing Co., Fresh Hop Hoppy Palm Pale Ale
912, Brouwerij St. Bernardus, St. Bernardus Christmas Ale
3441, Avery Brewing Company, Dihos Dactylion
3132, Lagunitas Brewing Company, Fusion 15
808, Hornsby's Pubdrafts, Amber
698, Ballast Point Brewing & Spirits, Sour Wench with Raspberries
3613, Nøgne Ø, Dark Horizon 2nd Edition
304, Bayerische Staatsbrauerei Weihenstephan, Weihenstephaner Pils
2443, Ratio Beerworks, Hold Steady
2944, Bootlegger's Brewery, Far Out IPA
2334, BridgePort Brewing Co., Stumptown Tart (2014)
781, Allagash Brewing Company, Confluence
2459, Intuition Ale Works, I-10 IPA
2220, Tioga-Sequoia Brewing Co. , Embalming Fluid
444, Creekside Brewing Company, Roggenbier
2081, Clown Shoes, Crunkle Sam
193, Hangar 24 Craft Brewery, Local Fields Series: Essence
3849, The Hop Concept, Lemon & Grassy
1170, Kona Brewing Company, Fire Rock Pale Ale
3708, Löwenbrauerei Passau, Urtyp Hell
883, The Libertine Pub, Framboise
310, Flensburger Brauerei Emil Petersen, Flensburger Pilsener
314, The Bruery, Oude Tart
1563, Goose Island Beer Co., Honker's Ale
2117, Bootlegger's Brewery, Mint Chocolate Porter
2432, New Belgium Brewing Company, Oatmeal IPA (Hop Kitchen)
3548, Lawson's Finest Liquids, Fayston Maple Imperial Stout
2271, BarrelHouse Brewing Co, TastyHouse Double IPA
380, Ballast Point Brewing & Spirits, Dorado Double IPA
3263, The Bruery, Grey Monday
3502, Brouwerij Oud Beersel, Oude Kriek (Vieille)
3425, Uncommon Brewers, Siamese Twin Ale
110, Brouwerij Lindemans, Pêche (Pêcheresse)
2877, Almanac Beer Co., Bourbon Sour Porter
174, Tahoe Mountain Brewing Company, Hot Pants
1511, Sierra Nevada Brewing Co., Porter
2235, To Øl, Black Malts & Body Salts
2151, Weldebräu, Badisch Gose
1634, New Belgium Brewing Company, Accumulation
764, Santa Barbara Brewing Company, Vat 629
3537, Upland Brewing Company, Dantalion
1466, Cismontane Brewing Co., California Buckwheat Oktoberfest
2886, Mad Duck Neighborhood Grill & Taphouse, Citra Batch 1
1825, Council Brewing Company, Beatitude Mosaic Dry Hopped Tart Saison
2980, Green Flash Brewing Co., Saison Tart
2791, Firestone Walker Brewing Company, Parabola (2013)
253, 21st Amendment Brewery , Brew Free! or Die IPA
3474, Brouwerij De Molen, Willens & Wetens
2705, Odell Brewing Co., Dr. Acula
439, Weisses Bräuhaus G. Schneider & Sohn, Schneider Weisse Unser Aventinus (TAP6)
766, Santa Barbara Brewing Company, Old Town Nut Brown
674, Woodchuck Cidery, Woodchuck Pear Hard Cider
1221, Doomsday Brewing Company, Nuclear IPA
367, San Miguel Brewery, San Miguel Pale Pilsen
705, Old Redwood Brewing Company, Picker's Saison
2457, New Belgium Brewing Company, Transatlantique Kriek (Lips of Faith) (2015)
490, Speakeasy Ales & Lagers, Prohibition Ale
3638, Magnolia Brewing Company, Pearly Baker's Best Bitter
2949, New Belgium Brewing Company, Transatlantique Kriek (Lips of Faith) (2013)
2748, Trinity Brewing Co. (Colorado), TPS Report
2482, Prairie Artisan Ales, Cherry Funk
3070, Creekside Brewing Company, Hefeweizen
1843, Aftershock Brewing Co, Peanut Alert
1473, Great Divide Brewing Company, Titan IPA
2336, Night Shift Brewing, Somer Weisse
3899, Angry Orchard Cider Company, Summer Honey
1014, Bruery Terreux®, Hottenroth
1081, Blue Moon Brewing Company, Blackberry Tart Ale
592, Buffalo Bill's Brewery (California), Blueberry Oatmeal Stout
2198, Modern Times Beer, Lost Horizon
3568, Hillcrest Brewing Company, Banana Hammock
1861, Smuttynose Brewing Co., Pumpkin Ale
3767, Stone Brewing Co., Stone Enjoy By 10.31.15 IPA
3549, The Lost Abbey, Veritas 009
1641, Cervecería Mexicana S. de R.L. de C.V. (Tecate), Furo
2592, Redd's Brewing Company, Wicked Apple
772, Central Coast Brewing, Stenner Creek Stout
1766, BridgePort Brewing Co., Trilogy 2
1561, Drake's Brewing Company, Denogginizer
3884, Uinta Brewing Company, Tilted Smile Imperial Pilsner
98, Firestone Walker Brewing Company, DBA (Double Barrel Ale)
150, Green Flash Brewing Co., Silva Stout (2015)
3763, Regal Brau, Thirsty Miner Stratum 2X IPA 
646, Left Coast Brewing, South County IPA
2402, Drake's Brewing Company, Cocoa Caliente Barrel Aged Porter
152, Firestone Walker Brewing Company, Helldorado (2015)
3639, Bison Brewing Co., Bison Organic IPA
2656, Russian River Brewing Company, Temptation
1481, Steinhaus Brewing Company, Mission St. India Pale Ale
793, Bear Republic Brewing Co., Café Racer 15 (2015)
12, Grupo Damm, Estrella Damm
66, Lagunitas Brewing Company, Pils
3867, Ballast Point Brewing & Spirits, Victory at Sea (Coffee Only Edition)
1965, Heartland Brewery, Indian River Light Ale
1503, Ace Cider (The California Cider Company), Ace Apple Cider
2519, The Bruery, Ichigo Highway
3617, Kern River Brewing Company, Winter Ale
2818, Prairie Artisan Ales, Bomb! (Batch 5 - Orange Wax)
1353, Hangzhou Quiandaohu Beer Co. (Cheerday Brewery), Lucky Beer (Lucky Buddha)
3675, AleSmith Brewing Company, Wee Heavy (WLP575)
2121, Wild Donkey Brewing Company, Whiskey Stout
1913, Clown Shoes, Pierre Ferrand Billionaire (2015)
1902, Coronado Brewing Company, Señor Saison
358, Ballast Point Brewing & Spirits, Tongue Buckler
437, Square Mile Cider Co, Spur & Vine
3596, San Diego Brewing Company, Old Nick's Holiday Fix
3434, Ipecac, Exploding Generator
1603, Heineken Brewery Ireland, Murphy's Irish Stout
1043, Lost Coast Brewery, Alleycat Amber
334, Karl Strauss Brewing Company, Who's Your Pappy?
114, Stone Brewing Co., Coffee Milk Stout
183, The Bruery, Autumn Maple
2661, The Rare Barrel, Ensorcelled
2504, Mission Brewery, Don't Act Like You're Not Impressed IPA
3612, Pizza Beer Company, Mamma Mia! Pizza Beer
958, The Lost Abbey, 10 Commandments
2829, Stone Brewing Co., Stone Enjoy By 02.14.14 IPA
538, Big Sky Brewing Company, Moose Drool Brown Ale
54, Stone Brewing Co., Stone Enjoy By 04.20.14 IPA
1471, Guinness, Harp Premium Lager
2766, Steelhead Brewing Co., Byronweiser Lager
2777, New Belgium Brewing Company, Gruit (Lips of Faith)
2974, AleSmith Brewing Company, Speedway Stout (Cherry Amaretto)
2189, CraftHaus Brewery, Resinate IPA
1601, Caledonian Brewing Company , British Session India Pale Ale
2447, AC Golden Brewing Co., Ctayt
236, Ruhstaller, Old Soul The Kenyan
3531, Hill Farmstead Brewery, Double Galaxy
2243, Brasserie Dubuisson, Cuvée des Trolls
3256, Lagunitas Brewing Company, Fusion 13
3260, Cycle Brewing Company, Nooner
1404, Duvel Moortgat, Duvel Single Fermented
1294, Stadium Brewing Company, Oatmeal Stout
3736, Almanac Beer Co., Farmer's Reserve Citrus
789, Boston Beer Company (Samuel Adams), Samuel Adams Boston Lager
3855, Adirondack Brewery, Beaver Tail Brown Ale
2037, Firestone Walker Brewing Company, Sour Opal
1858, The Mason Jar Brewing Company, The Wicked Daughter
2337, Paradise Creek Brewery, Huckleberry Pucker
1350, Pizza Port Brewing Co. , P.P.B.R.
902, House Of Pendragon Brewing Co., Belgian Blonde Ale
949, Firestone Walker Brewing Company, Firestone 14 Anniversary Ale
2646, Stone Brewing Co., Stone Brewing World Bistro & Gardens - Liberty Station Hot Lil’ Miami Tart
2899, Brewery Ommegang, Hop House
1837, Karl Strauss Brewing Company, Peanut Butter Cup Porter
1990, Oceanside Ale Works, DUDE
2416, Fiddlehead Brewing Company, Second Fiddle
2938, Figueroa Mountain Brewing Co., Cask Hoppy Poppy With Cascade And Citra
3757, Brooklyn Brewery, Wild Streak
3224, Monkey Paw Brewing Company, A.N.Z.A.C. Aussie Ale
2386, Mikkeller, Black Hole Barrel Aged White Wine
3238, Port Brewing Company, Mel Dorado
3886, Dunbar Brewing, Brown Porter 
1156, Pizza Port Brewing Co. , Hoptoberfest
2376, de Garde Brewing, Tableau Rouge
1458, Stone Brewing Co., Stone Enjoy By 12.05.14 IPA
2440, Ratio Beerworks, Genius Wizard
2172, The Bruery, Sans Pagaie (2013)
827, Klosterbrauerei Weltenburg, Weltenburger Asam Bock
29, Grupo Modelo S.A. de C.V., Victoria
2405, Sixpoint Brewery, Hi-Res (2015)
3368, Squatters Craft Beers, Fifth Element
267, The Lost Abbey, Cuvée de Tomme
1388, Artifex Brewing Company, A.H.A.B IPA (another hoppy ass beer) 
1315, Ballast Point Brewing & Spirits, Fathom
2929, ManRock Brewing Co., Reaper-Cussion
2492, Drake's Brewing Company, Scarlet O'Bretta
3577, Rip Current Brewing Co., Red Flag
1686, Kiuchi Brewery, Hitachino Nest White Ale
2699, Green Flash Brewing Co., Little Freak
2476, Sante Adairius Rustic Ales, Fumare (Barrel Aged)
1571, Anheuser-Busch, Bud Light Lime
1197, Sierra Nevada Brewing Co., Oktoberfest
1923, Bravery Brewing, Brandy Barrel Batch #100 Barleywine
2143, Six Rivers Brewery, Weatherman Kettle Sour Wheat
1840, The Mason Jar Brewing Company, Candy Cornholio
1956, Founders Brewing Co., Dirty Bastard (2014)
1627, Yuengling Brewery, Traditional Lager
1835, Clown Shoes, Space Cake
2348, Allagash Brewing Company, Session Brett Ale
2077, Black Market Brewing Co., 5th Anniversary - Kentucky Common Ale
3385, Thomas Creek Brewery, Up the Creek Extreme IPA
3780, BrewDog, Jack Hammer
2091, Coronado Brewing Company, Sock Knocker
3745, Evil Twin Brewing, Molotov Cocktail
3514, Automatic Brewing Co., Cape Townie
3292, Mother Earth Brew Co. (California), Cinco De Rye-O
549, Tap It Brewing Co, American Pale Ale
2062, New Belgium Brewing Company, Transatlantique Kriek (2014)
2043, Solvang Brewing Company, Zythos Extra IPA
1986, Mission Brewery, Malleus
1083, Founders Brewing Co., Dirty Bastard (2012)
3888, Barrel Trolley Brewing, Barrel Trolley India Pale Ale
381, Deschutes Brewery, Fresh Squeezed IPA
3398, Amplified Ale Works, Bearded Guard
1336, Pizza Port Brewing Co. , Abbey Mae IPA
1316, Oskar Blues Brewery, Dale's Pale Ale
682, Åbro Bryggeri, Rekorderlig Premium Wild Berries Hard Cider
406, Deschutes Brewery, Black Butte XXV
1255, Lagunitas Brewing Company, The Waldos' Special Ale (AKA Waldo's 420) (2015)
1852, Bottle Logic Brewing, Double Actuator
158, Barrel Harbor Brewing, Fenris IPA
2874, Pizza Port Brewing Co. , Ponto Session IPA
1461, Arrogant Bastard Brewing Co., Double Bastard Ale
186, Speakeasy Ales & Lagers, Payback Porter
3769, Old Schoolhouse Brewery, Imperial IPA (Brewer's Reserve)
2002, Highland Brewing Company, Devil's Britches
2272, BarrelHouse Brewing Co, Barrel Select Riesling Blonde Sour | Batch No. 1401
740, House Of Pendragon Brewing Co., Big Ass Zealous
2003, Bear Republic Brewing Co., Big Bear Black Stout™
1740, The Bruery, Sucré (Bourbon Barrel Aged)
1995, Highland Park Brewery, Fun Juice
3551, Cigar City Brewing, Moat Water
459, Boston Beer Company (Samuel Adams), Samuel Adams OctoberFest
2095, Brew Rebellion, John Paul Jones Stout White Chocolate And Raspberry
965, Heretic Brewing Company, Black Maria
2188, CraftHaus Brewery, Belgard Belgian Stout
3146, Santa Cruz Mountain Brewing, Pepe's Lavender IPA
855, BJ's Restaurant and Brewhouse, Nit Wit®
83, 21st Amendment Brewery , Hell or High Watermelon
2616, Ladyface Alehouse and Brasserie, La Trappistine
612, Noble Ale Works, The Financier
2645, The Commons Brewery, Biere Royale
1059, BJ's Restaurant and Brewhouse, Goliath™ Imperial Red Ale
1572, Cervecería Cuauhtémoc Moctezuma S.A. de C.V., Dos Equis Azul
1685, Boulevard Brewing Co., Long Strange Tripel
227, Deschutes Brewery, Not The Stoic
501, Plzeňský Prazdroj, Pilsner Urquell
199, Ballast Point Brewing & Spirits, Homework Series Batch #5 - Belgian Style Pale Ale
383, Rogue Ales & Spirits, Rogue Farms 7 Hop IPA
2972, AleSmith Brewing Company, Speedway Stout (Bird's Eye Thai Chili)
26, SweetWater Brewing Company , IPA
617, Dogfish Head Craft Brewery, 120 Minute IPA (2015)
1536, Anheuser-Busch, Bud Light Lime Lime-A-Rita
3252, Green Flash Brewing Co., Saison Diego
1621, Breckenridge Brewery, Christmas Ale
1672, Sierra Nevada Brewing Co., Maillard's Odyssey
3052, Green Flash Brewing Co., East Village Pilsner
1875, Left Coast Brewing, Barrel Aged Get In My Belly
479, BJ's Restaurant and Brewhouse, Jeremiah Red®
911, Brouwerij Het Anker, Gouden Carolus Christmas
3343, Ballast Point Brewing & Spirits, Indra Kunindra (Barrel Aged)
1253, Avery Brewing Company, Joe’s Premium American Pilsner
2648, FiftyFifty Brewing Co., Miso Hoppy
732, 21st Amendment Brewery , Hop Crisis
460, Firestone Walker Brewing Company, Oaktoberfest
1514, Modern Times Beer, Mega Black House
3838, Russian River Brewing Company, Consecration (Batch 031315)
3206, Ladyface Alehouse and Brasserie, Cataclysm Imperial Oatmeal IPA
3451, San Marcos Brewery & Grill, Old Goat's Oats
1464, Avery Brewing Company, The Beast Grand Cru
609, Noble Ale Works, Happy Danksgiving
2120, Wild Donkey Brewing Company, Cinna-Brew
2104, Ritual Brewing Company, Art of Dankness
1703, Brouwerij Alken-Maes, Grimbergen Dubbel
1095, Rogue Ales & Spirits, 25 Integrity Ale
3024, House Of Pendragon Brewing Co., Arthur
3649, Great Divide Brewing Company, Hoss
2619, Stone Brewing Co., Stone "The Tiger Cub" Saison aged in White Wine Barrels
3035, Jolly Pumpkin Artisan Ales, La Parcela (2012)
563, Russian River Brewing Company, Blind Pig IPA
1569, Anacapa Brewing Company, Farmer Flannel Maple Brown
854, Lagunitas Brewing Company, The Waldos' Special Ale (AKA Waldo's 420)
707, Lagunitas Brewing Company, A Little Sumpin' Extra! Ale
3480, Alpine Beer Company (CA), Good
2676, De Struise Brouwers, Weltfreude
785, Sierra Nevada Brewing Co., Barrel-Aged Bigfoot Barleywine Style (2015)
2049, Humboldt Brewing Company, Black Xantus (2014)
3550, New Glarus Brewing Company, Raspberry Tart
427, Firestone Walker Brewing Company, Velvet Merkin (2014)
14, Brooklyn Brewery, Brooklyn Lager
3860, Peak Organic Brewing Company, Fall Summit Ale
1951, Coney Island Brewing Company, Mermaid Pilsner
1132, Bruery Terreux®, Souren
